SAMPID,SITE,STRTDATE,YEAR,MONTH,DAY,FLWRATE,DURATION,CASNO1,CpdGp,COMPOUND,Raw_Result,EPD_CONC,Glab_Result,Unit,Validation,Comment,Flag,,,,,
TWSCDS20141301A1,TW,13/1/2014,2014,1,13,230.4,1431,143-50-0,CD,Chlordecone,-0.2,0.303303828,-0.6,4,1,,,,,,,
TWSCDS20141301A2,TW,13/1/2014,2014,1,13,229.2,1396,143-50-0,CD,Chlordecone,-0.2,0.312535942,-0.6,4,0,Co-location,,,,,,
TWSCDS20142402,TW,24/2/2014,2014,2,24,231.1,1403,143-50-0,CD,Chlordecone,-0.2,0.308419894,-0.6,4,1,,,,,,,
TWSCDS20140603,TW,6/3/2014,2014,3,6,229.2,1426,143-50-0,CD,Chlordecone,-0.2,0.305960852,-0.6,4,1,,,,,,,
TWSCDS20141304A1,TW,13/4/2014,2014,4,13,231.7,1438,143-50-0,CD,Chlordecone,-0.2,0.30013392,-0.6,4,1,,,,,,,
TWSCDS20141304A2,TW,13/4/2014,2014,4,13,231.4,1426,143-50-0,CD,Chlordecone,-0.2,0.303051976,-0.6,4,0,Co-location,,,,,,
TWSCDS20142505,TW,25/5/2014,2014,5,25,229.2,1426,143-50-0,CD,Chlordecone,-0.2,0.305960852,-0.6,4,1,,,,,,,
TWSCDS20140606,TW,6/6/2014,2014,6,6,232.1,1467,143-50-0,CD,Chlordecone,-0.2,0.293693778,-0.6,4,1,,,,,,,
CWSCLS20140701,CW,7/1/2014,2014,1,7,0.6956,1440,50-00-0,CL,Formaldehyde,2.9,2.9,2.9,4,1,,,,,,,
CWSCLS20140701,CW,7/1/2014,2014,1,7,0.6956,1440,75-07-0,CL,Acetaldehyde,1.5,1.5,1.5,4,1,,,,,,,
CWSCLS20140701,CW,7/1/2014,2014,1,7,0.6956,1440,107-02-8,CL,Acrolein,-0.01,0.01,-0.01,4,1,,,,,,,
CWSCLS20140701,CW,7/1/2014,2014,1,7,0.6956,1440,67-64-1,CL,Acetone,1.4,1.4,1.4,4,1,,,,,,,
CWSCLS20140701,CW,7/1/2014,2014,1,7,0.6956,1440,123-38-6,CL,Propionaldehyde,0.15,0.15,0.14,4,1,,,,,,,
CWSCLS20140701,CW,7/1/2014,2014,1,7,0.6956,1440,123-73-9,CL,Crotonaldehyde,-0.01,0.01,-0.01,4,1,,,,,,,
CWSCLS20140701,CW,7/1/2014,2014,1,7,0.6956,1440,78-93-3,CL,Methyl ethyl ketone,0.75,0.75,0.75,4,1,,,,,,,
CWSCLS20140701,CW,7/1/2014,2014,1,7,0.6956,1440,123-72-8,CL,Butyraldehyde/IBA,0.09,0.09,0.09,4,1,,,,,,,
CWSCLS20140701,CW,7/1/2014,2014,1,7,0.6956,1440,100-52-7,CL,Benzaldehyde,0.38,0.38,0.38,4,1,,,,,,,
CWSCLS20140701,CW,7/1/2014,2014,1,7,0.6956,1440,590-86-3,CL,Isovaleraldehyde,-0.01,0.01,-0.01,4,1,,,,,,,
CWSCLS20140701,CW,7/1/2014,2014,1,7,0.6956,1440,110-62-3,CL,Valeraldehyde,0.14,0.14,0.13,4,1,,,,,,,
CWSCLS20140701,CW,7/1/2014,2014,1,7,0.6956,1440,529-20-4,CL,o-Tolualdehyde,-0.01,0.01,-0.01,4,1,,,,,,,
CWSCLS20140701,CW,7/1/2014,2014,1,7,0.6956,1440,620-23-5,CL,m-Tolualdehyde,-0.01,0.01,-0.01,4,1,,,,,,,
CWSCLS20140701,CW,7/1/2014,2014,1,7,0.6956,1440,104-87-0,CL,p-Tolualdehyde,-0.01,0.01,-0.01,4,1,,,,,,,
CWSCLS20140701,CW,7/1/2014,2014,1,7,0.6956,1440,66-25-1,CL,Hexaldehyde,0.15,0.15,0.15,4,1,,,,,,,
CWSCLS20140701,CW,7/1/2014,2014,1,7,0.6956,1440,5779-94-2,CL,"2,5-Dimethylbenzaldehyde",-0.01,0.01,-0.01,4,1,,,,,,,
TWSCLS20142501,TW,25/1/2014,2014,1,25,0.7036,1440,50-00-0,CL,Formaldehyde,14,13.82,14,4,1,,,,,,,
TWSCLS20142501,TW,25/1/2014,2014,1,25,0.7036,1440,75-07-0,CL,Acetaldehyde,4.1,4.05,4.1,4,1,,,,,,,
TWSCLS20142501,TW,25/1/2014,2014,1,25,0.7036,1440,107-02-8,CL,Acrolein,-0.01,0.01,-0.01,4,1,,,,,,,
TWSCLS20142501,TW,25/1/2014,2014,1,25,0.7036,1440,67-64-1,CL,Acetone,1.9,1.88,1.9,4,1,,,,,,,
TWSCLS20142501,TW,25/1/2014,2014,1,25,0.7036,1440,123-38-6,CL,Propionaldehyde,0.57,0.56,0.56,4,1,,,,,,,
TWSCLS20142501,TW,25/1/2014,2014,1,25,0.7036,1440,123-73-9,CL,Crotonaldehyde,-0.01,0.01,-0.01,4,1,,,,,,,
TWSCLS20142501,TW,25/1/2014,2014,1,25,0.7036,1440,78-93-3,CL,Methyl ethyl ketone,3.1,3.06,3,4,1,,,,,,,
TWSCLS20142501,TW,25/1/2014,2014,1,25,0.7036,1440,123-72-8,CL,Butyraldehyde/IBA,0.63,0.62,0.62,4,1,,,,,,,
TWSCLS20142501,TW,25/1/2014,2014,1,25,0.7036,1440,100-52-7,CL,Benzaldehyde,3,2.96,3,4,1,,,,,,,
TWSCLS20142501,TW,25/1/2014,2014,1,25,0.7036,1440,590-86-3,CL,Isovaleraldehyde,0.04,0.04,0.04,4,1,,,,,,,
TWSCLS20142501,TW,25/1/2014,2014,1,25,0.7036,1440,110-62-3,CL,Valeraldehyde,0.78,0.77,0.77,4,1,,,,,,,
TWSCLS20142501,TW,25/1/2014,2014,1,25,0.7036,1440,529-20-4,CL,o-Tolualdehyde,-0.01,0.01,-0.01,4,1,,,,,,,
TWSCLS20142501,TW,25/1/2014,2014,1,25,0.7036,1440,620-23-5,CL,m-Tolualdehyde,-0.01,0.01,-0.01,4,1,,,,,,,
TWSCLS20142501,TW,25/1/2014,2014,1,25,0.7036,1440,104-87-0,CL,p-Tolualdehyde,-0.01,0.01,-0.01,4,1,,,,,,,
TWSCLS20142501,TW,25/1/2014,2014,1,25,0.7036,1440,66-25-1,CL,Hexaldehyde,0.88,0.87,0.86,4,1,,,,,,,
TWSCLS20142501,TW,25/1/2014,2014,1,25,0.7036,1440,5779-94-2,CL,"2,5-Dimethylbenzaldehyde",0.11,0.11,0.1,4,1,,,,,,,
CWSCLS20141802,CW,18/2/2014,2014,2,18,0.6956,1440,50-00-0,CL,Formaldehyde,3.8,3.79,3.8,4,1,,,,,,,
CWSCLS20141802,CW,18/2/2014,2014,2,18,0.6956,1440,75-07-0,CL,Acetaldehyde,3,3,3,4,1,,,,,,,
CWSCLS20141802,CW,18/2/2014,2014,2,18,0.6956,1440,107-02-8,CL,Acrolein,-0.01,0.01,-0.01,4,1,,,,,,,
CWSCLS20141802,CW,18/2/2014,2014,2,18,0.6956,1440,67-64-1,CL,Acetone,2.2,2.2,2.2,4,1,,,,,,,
CWSCLS20141802,CW,18/2/2014,2014,2,18,0.6956,1440,123-38-6,CL,Propionaldehyde,0.64,0.64,0.64,4,1,,,,,,,
CWSCLS20141802,CW,18/2/2014,2014,2,18,0.6956,1440,123-73-9,CL,Crotonaldehyde,-0.01,0.01,-0.01,4,1,,,,,,,
CWSCLS20141802,CW,18/2/2014,2014,2,18,0.6956,1440,78-93-3,CL,Methyl ethyl ketone,2.1,2.1,2,4,1,,,,,,,
CWSCLS20141802,CW,18/2/2014,2014,2,18,0.6956,1440,123-72-8,CL,Butyraldehyde/IBA,0.39,0.39,0.39,4,1,,,,,,,
CWSCLS20141802,CW,18/2/2014,2014,2,18,0.6956,1440,100-52-7,CL,Benzaldehyde,-0.01,0.01,-0.01,4,1,,,,,,,
CWSCLS20141802,CW,18/2/2014,2014,2,18,0.6956,1440,590-86-3,CL,Isovaleraldehyde,-0.01,0.01,-0.01,4,1,,,,,,,
CWSCLS20141802,CW,18/2/2014,2014,2,18,0.6956,1440,110-62-3,CL,Valeraldehyde,0.78,0.78,0.78,4,1,,,,,,,
CWSCLS20141802,CW,18/2/2014,2014,2,18,0.6956,1440,529-20-4,CL,o-Tolualdehyde,-0.01,0.01,-0.01,4,1,,,,,,,
CWSCLS20141802,CW,18/2/2014,2014,2,18,0.6956,1440,620-23-5,CL,m-Tolualdehyde,-0.01,0.01,-0.01,4,1,,,,,,,
CWSCLS20141802,CW,18/2/2014,2014,2,18,0.6956,1440,104-87-0,CL,p-Tolualdehyde,-0.01,0.01,-0.01,4,1,,,,,,,
CWSCLS20141802,CW,18/2/2014,2014,2,18,0.6956,1440,66-25-1,CL,Hexaldehyde,0.49,0.49,0.49,4,1,,,,,,,
CWSCLS20141802,CW,18/2/2014,2014,2,18,0.6956,1440,5779-94-2,CL,"2,5-Dimethylbenzaldehyde",-0.01,0.01,-0.01,4,1,,,,,,,
TWSCLS20141202,TW,12/2/2014,2014,2,12,0.7045,1440,50-00-0,CL,Formaldehyde,6,5.91,5.9,4,1,,,,,,,
TWSCLS20141202,TW,12/2/2014,2014,2,12,0.7045,1440,75-07-0,CL,Acetaldehyde,2.1,2.07,2.1,4,1,,,,,,,
TWSCLS20141202,TW,12/2/2014,2014,2,12,0.7045,1440,107-02-8,CL,Acrolein,-0.01,0.01,-0.01,4,1,,,,,,,
TWSCLS20141202,TW,12/2/2014,2014,2,12,0.7045,1440,67-64-1,CL,Acetone,4.1,4.04,4,4,1,,,,,,,
TWSCLS20141202,TW,12/2/2014,2014,2,12,0.7045,1440,123-38-6,CL,Propionaldehyde,0.36,0.35,0.35,4,1,,,,,,,
TWSCLS20141202,TW,12/2/2014,2014,2,12,0.7045,1440,123-73-9,CL,Crotonaldehyde,-0.01,0.01,-0.01,4,1,,,,,,,
TWSCLS20141202,TW,12/2/2014,2014,2,12,0.7045,1440,78-93-3,CL,Methyl ethyl ketone,2.7,2.66,2.7,4,1,,,,,,,
TWSCLS20141202,TW,12/2/2014,2014,2,12,0.7045,1440,123-72-8,CL,Butyraldehyde/IBA,0.32,0.32,0.32,4,1,,,,,,,
TWSCLS20141202,TW,12/2/2014,2014,2,12,0.7045,1440,100-52-7,CL,Benzaldehyde,1.1,1.08,1.1,4,1,,,,,,,
TWSCLS20141202,TW,12/2/2014,2014,2,12,0.7045,1440,590-86-3,CL,Isovaleraldehyde,0.12,0.12,0.12,4,1,,,,,,,
TWSCLS20141202,TW,12/2/2014,2014,2,12,0.7045,1440,110-62-3,CL,Valeraldehyde,0.55,0.54,0.54,4,1,,,,,,,
TWSCLS20141202,TW,12/2/2014,2014,2,12,0.7045,1440,529-20-4,CL,o-Tolualdehyde,-0.01,0.01,-0.01,4,1,,,,,,,
TWSCLS20141202,TW,12/2/2014,2014,2,12,0.7045,1440,620-23-5,CL,m-Tolualdehyde,-0.01,0.01,-0.01,4,1,,,,,,,
TWSCLS20141202,TW,12/2/2014,2014,2,12,0.7045,1440,104-87-0,CL,p-Tolualdehyde,-0.01,0.01,-0.01,4,1,,,,,,,
TWSCLS20141202,TW,12/2/2014,2014,2,12,0.7045,1440,66-25-1,CL,Hexaldehyde,0.34,0.34,0.34,4,1,,,,,,,
TWSCLS20141202,TW,12/2/2014,2014,2,12,0.7045,1440,5779-94-2,CL,"2,5-Dimethylbenzaldehyde",-0.01,0.01,-0.01,4,1,,,,,,,
CWSCLS20142403A1,CW,24/3/2014,2014,3,24,0.6956,1440,50-00-0,CL,Formaldehyde,1.3,1.3,1.3,4,1,,,,,,,
CWSCLS20142403A1,CW,24/3/2014,2014,3,24,0.6956,1440,75-07-0,CL,Acetaldehyde,1.4,1.4,1.4,4,1,,,,,,,
CWSCLS20142403A1,CW,24/3/2014,2014,3,24,0.6956,1440,107-02-8,CL,Acrolein,-0.01,0.01,-0.01,4,1,,,,,,,
CWSCLS20142403A1,CW,24/3/2014,2014,3,24,0.6956,1440,67-64-1,CL,Acetone,1.2,1.2,1.2,4,1,,,,,,,
CWSCLS20142403A1,CW,24/3/2014,2014,3,24,0.6956,1440,123-38-6,CL,Propionaldehyde,0.13,0.13,0.13,4,1,,,,,,,
CWSCLS20142403A1,CW,24/3/2014,2014,3,24,0.6956,1440,123-73-9,CL,Crotonaldehyde,-0.01,0.01,-0.01,4,1,,,,,,,
CWSCLS20142403A1,CW,24/3/2014,2014,3,24,0.6956,1440,78-93-3,CL,Methyl ethyl ketone,0.17,0.17,0.17,4,1,,,,,,,
CWSCLS20142403A1,CW,24/3/2014,2014,3,24,0.6956,1440,123-72-8,CL,Butyraldehyde/IBA,-0.01,0.01,-0.01,4,1,,,,,,,
CWSCLS20142403A1,CW,24/3/2014,2014,3,24,0.6956,1440,100-52-7,CL,Benzaldehyde,0.58,0.58,0.58,4,1,,,,,,,
CWSCLS20142403A1,CW,24/3/2014,2014,3,24,0.6956,1440,590-86-3,CL,Isovaleraldehyde,-0.01,0.01,-0.01,4,1,,,,,,,
CWSCLS20142403A1,CW,24/3/2014,2014,3,24,0.6956,1440,110-62-3,CL,Valeraldehyde,0.08,0.08,0.08,4,1,,,,,,,
CWSCLS20142403A1,CW,24/3/2014,2014,3,24,0.6956,1440,529-20-4,CL,o-Tolualdehyde,-0.01,0.01,-0.01,4,1,,,,,,,
CWSCLS20142403A1,CW,24/3/2014,2014,3,24,0.6956,1440,620-23-5,CL,m-Tolualdehyde,-0.01,0.01,-0.01,4,1,,,,,,,
CWSCLS20142403A1,CW,24/3/2014,2014,3,24,0.6956,1440,104-87-0,CL,p-Tolualdehyde,-0.01,0.01,-0.01,4,1,,,,,,,
CWSCLS20142403A1,CW,24/3/2014,2014,3,24,0.6956,1440,66-25-1,CL,Hexaldehyde,-0.01,0.01,-0.01,4,1,,,,,,,
CWSCLS20142403A1,CW,24/3/2014,2014,3,24,0.6956,1440,5779-94-2,CL,"2,5-Dimethylbenzaldehyde",-0.01,0.01,-0.01,4,1,,,,,,,
CWSCLS20142403A2,CW,24/3/2014,2014,3,24,0.6969,1440,50-00-0,CL,Formaldehyde,1.3,1.3,1.3,4,0,Co-location,,,,,,
CWSCLS20142403A2,CW,24/3/2014,2014,3,24,0.6969,1440,75-07-0,CL,Acetaldehyde,1.4,1.4,1.4,4,0,Co-location,,,,,,
CWSCLS20142403A2,CW,24/3/2014,2014,3,24,0.6969,1440,107-02-8,CL,Acrolein,-0.01,0.01,-0.01,4,0,Co-location,,,,,,
CWSCLS20142403A2,CW,24/3/2014,2014,3,24,0.6969,1440,67-64-1,CL,Acetone,1.2,1.2,1.2,4,0,Co-location,,,,,,
CWSCLS20142403A2,CW,24/3/2014,2014,3,24,0.6969,1440,123-38-6,CL,Propionaldehyde,0.11,0.11,0.11,4,0,Co-location,,,,,,
CWSCLS20142403A2,CW,24/3/2014,2014,3,24,0.6969,1440,123-73-9,CL,Crotonaldehyde,-0.01,0.01,-0.01,4,0,Co-location,,,,,,
CWSCLS20142403A2,CW,24/3/2014,2014,3,24,0.6969,1440,78-93-3,CL,Methyl ethyl ketone,0.18,0.18,0.18,4,0,Co-location,,,,,,
CWSCLS20142403A2,CW,24/3/2014,2014,3,24,0.6969,1440,123-72-8,CL,Butyraldehyde/IBA,-0.01,0.01,-0.01,4,0,Co-location,,,,,,
CWSCLS20142403A2,CW,24/3/2014,2014,3,24,0.6969,1440,100-52-7,CL,Benzaldehyde,0.58,0.58,0.58,4,0,Co-location,,,,,,
CWSCLS20142403A2,CW,24/3/2014,2014,3,24,0.6969,1440,590-86-3,CL,Isovaleraldehyde,-0.01,0.01,-0.01,4,0,Co-location,,,,,,
CWSCLS20142403A2,CW,24/3/2014,2014,3,24,0.6969,1440,110-62-3,CL,Valeraldehyde,0.09,0.09,0.09,4,0,Co-location,,,,,,
CWSCLS20142403A2,CW,24/3/2014,2014,3,24,0.6969,1440,529-20-4,CL,o-Tolualdehyde,-0.01,0.01,-0.01,4,0,Co-location,,,,,,
CWSCLS20142403A2,CW,24/3/2014,2014,3,24,0.6969,1440,620-23-5,CL,m-Tolualdehyde,-0.01,0.01,-0.01,4,0,Co-location,,,,,,
CWSCLS20142403A2,CW,24/3/2014,2014,3,24,0.6969,1440,104-87-0,CL,p-Tolualdehyde,-0.01,0.01,-0.01,4,0,Co-location,,,,,,
CWSCLS20142403A2,CW,24/3/2014,2014,3,24,0.6969,1440,66-25-1,CL,Hexaldehyde,-0.01,0.01,-0.01,4,0,Co-location,,,,,,
CWSCLS20142403A2,CW,24/3/2014,2014,3,24,0.6969,1440,5779-94-2,CL,"2,5-Dimethylbenzaldehyde",-0.01,0.01,-0.01,4,0,Co-location,,,,,,
TWSCLS20141203A1,TW,12/3/2014,2014,3,12,0.7045,1440,50-00-0,CL,Formaldehyde,16,15.77,15,4,1,,,,,,,
TWSCLS20141203A1,TW,12/3/2014,2014,3,12,0.7045,1440,75-07-0,CL,Acetaldehyde,4.8,4.73,4.8,4,1,,,,,,,
TWSCLS20141203A1,TW,12/3/2014,2014,3,12,0.7045,1440,107-02-8,CL,Acrolein,-0.01,0.01,-0.01,4,1,,,,,,,
TWSCLS20141203A1,TW,12/3/2014,2014,3,12,0.7045,1440,67-64-1,CL,Acetone,2.5,2.46,2.4,4,1,,,,,,,
TWSCLS20141203A1,TW,12/3/2014,2014,3,12,0.7045,1440,123-38-6,CL,Propionaldehyde,0.81,0.8,0.8,4,1,,,,,,,
TWSCLS20141203A1,TW,12/3/2014,2014,3,12,0.7045,1440,123-73-9,CL,Crotonaldehyde,0.09,0.09,0.09,4,1,,,,,,,
TWSCLS20141203A1,TW,12/3/2014,2014,3,12,0.7045,1440,78-93-3,CL,Methyl ethyl ketone,2.9,2.86,2.9,4,1,,,,,,,
TWSCLS20141203A1,TW,12/3/2014,2014,3,12,0.7045,1440,123-72-8,CL,Butyraldehyde/IBA,0.83,0.82,0.82,4,1,,,,,,,
TWSCLS20141203A1,TW,12/3/2014,2014,3,12,0.7045,1440,100-52-7,CL,Benzaldehyde,3,2.96,3,4,1,,,,,,,
TWSCLS20141203A1,TW,12/3/2014,2014,3,12,0.7045,1440,590-86-3,CL,Isovaleraldehyde,0.34,0.34,0.33,4,1,,,,,,,
TWSCLS20141203A1,TW,12/3/2014,2014,3,12,0.7045,1440,110-62-3,CL,Valeraldehyde,0.67,0.66,0.66,4,1,,,,,,,
TWSCLS20141203A1,TW,12/3/2014,2014,3,12,0.7045,1440,529-20-4,CL,o-Tolualdehyde,-0.01,0.01,-0.01,4,1,,,,,,,
TWSCLS20141203A1,TW,12/3/2014,2014,3,12,0.7045,1440,620-23-5,CL,m-Tolualdehyde,-0.01,0.01,-0.01,4,1,,,,,,,
TWSCLS20141203A1,TW,12/3/2014,2014,3,12,0.7045,1440,104-87-0,CL,p-Tolualdehyde,-0.01,0.01,-0.01,4,1,,,,,,,
TWSCLS20141203A1,TW,12/3/2014,2014,3,12,0.7045,1440,66-25-1,CL,Hexaldehyde,1,0.99,1,4,1,,,,,,,
TWSCLS20141203A1,TW,12/3/2014,2014,3,12,0.7045,1440,5779-94-2,CL,"2,5-Dimethylbenzaldehyde",-0.01,0.01,-0.01,4,1,,,,,,,
TWSCLS20141203A2,TW,12/3/2014,2014,3,12,0.7046,1440,50-00-0,CL,Formaldehyde,15,14.78,15,4,0,Co-location,,,,,,
TWSCLS20141203A2,TW,12/3/2014,2014,3,12,0.7046,1440,75-07-0,CL,Acetaldehyde,4.6,4.53,4.6,4,0,Co-location,,,,,,
TWSCLS20141203A2,TW,12/3/2014,2014,3,12,0.7046,1440,107-02-8,CL,Acrolein,-0.01,0.01,-0.01,4,0,Co-location,,,,,,
TWSCLS20141203A2,TW,12/3/2014,2014,3,12,0.7046,1440,67-64-1,CL,Acetone,2.4,2.37,2.4,4,0,Co-location,,,,,,
TWSCLS20141203A2,TW,12/3/2014,2014,3,12,0.7046,1440,123-38-6,CL,Propionaldehyde,0.77,0.76,0.76,4,0,Co-location,,,,,,
TWSCLS20141203A2,TW,12/3/2014,2014,3,12,0.7046,1440,123-73-9,CL,Crotonaldehyde,0.08,0.08,0.08,4,0,Co-location,,,,,,
TWSCLS20141203A2,TW,12/3/2014,2014,3,12,0.7046,1440,78-93-3,CL,Methyl ethyl ketone,2.9,2.86,2.8,4,0,Co-location,,,,,,
TWSCLS20141203A2,TW,12/3/2014,2014,3,12,0.7046,1440,123-72-8,CL,Butyraldehyde/IBA,0.85,0.84,0.84,4,0,Co-location,,,,,,
TWSCLS20141203A2,TW,12/3/2014,2014,3,12,0.7046,1440,100-52-7,CL,Benzaldehyde,2.9,2.86,2.8,4,0,Co-location,,,,,,
TWSCLS20141203A2,TW,12/3/2014,2014,3,12,0.7046,1440,590-86-3,CL,Isovaleraldehyde,0.28,0.28,0.28,4,0,Co-location,,,,,,
TWSCLS20141203A2,TW,12/3/2014,2014,3,12,0.7046,1440,110-62-3,CL,Valeraldehyde,0.61,0.6,0.6,4,0,Co-location,,,,,,
TWSCLS20141203A2,TW,12/3/2014,2014,3,12,0.7046,1440,529-20-4,CL,o-Tolualdehyde,-0.01,0.01,-0.01,4,0,Co-location,,,,,,
TWSCLS20141203A2,TW,12/3/2014,2014,3,12,0.7046,1440,620-23-5,CL,m-Tolualdehyde,-0.01,0.01,-0.01,4,0,Co-location,,,,,,
TWSCLS20141203A2,TW,12/3/2014,2014,3,12,0.7046,1440,104-87-0,CL,p-Tolualdehyde,-0.01,0.01,-0.01,4,0,Co-location,,,,,,
TWSCLS20141203A2,TW,12/3/2014,2014,3,12,0.7046,1440,66-25-1,CL,Hexaldehyde,0.96,0.95,0.95,4,0,Co-location,,,,,,
TWSCLS20141203A2,TW,12/3/2014,2014,3,12,0.7046,1440,5779-94-2,CL,"2,5-Dimethylbenzaldehyde",-0.01,0.01,-0.01,4,0,Co-location,,,,,,
CWSCLS20140704,CW,7/4/2014,2014,4,7,0.6956,1440,50-00-0,CL,Formaldehyde,2.6,2.6,2.6,4,1,,,,,,,
CWSCLS20140704,CW,7/4/2014,2014,4,7,0.6956,1440,75-07-0,CL,Acetaldehyde,1.6,1.6,1.6,4,1,,,,,,,
CWSCLS20140704,CW,7/4/2014,2014,4,7,0.6956,1440,107-02-8,CL,Acrolein,-0.01,0.01,-0.01,4,1,,,,,,,
CWSCLS20140704,CW,7/4/2014,2014,4,7,0.6956,1440,67-64-1,CL,Acetone,1.1,1.1,1.1,4,1,,,,,,,
CWSCLS20140704,CW,7/4/2014,2014,4,7,0.6956,1440,123-38-6,CL,Propionaldehyde,0.09,0.09,0.09,4,1,,,,,,,
CWSCLS20140704,CW,7/4/2014,2014,4,7,0.6956,1440,123-73-9,CL,Crotonaldehyde,-0.01,0.01,-0.01,4,1,,,,,,,
CWSCLS20140704,CW,7/4/2014,2014,4,7,0.6956,1440,78-93-3,CL,Methyl ethyl ketone,0.5,0.5,0.5,4,1,,,,,,,
CWSCLS20140704,CW,7/4/2014,2014,4,7,0.6956,1440,123-72-8,CL,Butyraldehyde/IBA,0.09,0.09,0.09,4,1,,,,,,,
CWSCLS20140704,CW,7/4/2014,2014,4,7,0.6956,1440,100-52-7,CL,Benzaldehyde,0.48,0.48,0.48,4,1,,,,,,,
CWSCLS20140704,CW,7/4/2014,2014,4,7,0.6956,1440,590-86-3,CL,Isovaleraldehyde,-0.01,0.01,-0.01,4,1,,,,,,,
CWSCLS20140704,CW,7/4/2014,2014,4,7,0.6956,1440,110-62-3,CL,Valeraldehyde,0.08,0.08,0.08,4,1,,,,,,,
CWSCLS20140704,CW,7/4/2014,2014,4,7,0.6956,1440,529-20-4,CL,o-Tolualdehyde,-0.01,0.01,-0.01,4,1,,,,,,,
CWSCLS20140704,CW,7/4/2014,2014,4,7,0.6956,1440,620-23-5,CL,m-Tolualdehyde,-0.01,0.01,-0.01,4,1,,,,,,,
CWSCLS20140704,CW,7/4/2014,2014,4,7,0.6956,1440,104-87-0,CL,p-Tolualdehyde,-0.01,0.01,-0.01,4,1,,,,,,,
CWSCLS20140704,CW,7/4/2014,2014,4,7,0.6956,1440,66-25-1,CL,Hexaldehyde,0.12,0.12,0.12,4,1,,,,,,,
CWSCLS20140704,CW,7/4/2014,2014,4,7,0.6956,1440,5779-94-2,CL,"2,5-Dimethylbenzaldehyde",-0.01,0.01,-0.01,4,1,,,,,,,
TWSCLS20142504,TW,25/4/2014,2014,4,25,0.7047,1440,50-00-0,CL,Formaldehyde,21,20.69,20,4,1,,,,,,,
TWSCLS20142504,TW,25/4/2014,2014,4,25,0.7047,1440,75-07-0,CL,Acetaldehyde,4.2,4.14,4.1,4,1,,,,,,,
TWSCLS20142504,TW,25/4/2014,2014,4,25,0.7047,1440,107-02-8,CL,Acrolein,-0.01,0.01,-0.01,4,1,,,,,,,
TWSCLS20142504,TW,25/4/2014,2014,4,25,0.7047,1440,67-64-1,CL,Acetone,8.7,8.57,8.5,4,1,,,,,,,
TWSCLS20142504,TW,25/4/2014,2014,4,25,0.7047,1440,123-38-6,CL,Propionaldehyde,0.56,0.55,0.55,4,1,,,,,,,
TWSCLS20142504,TW,25/4/2014,2014,4,25,0.7047,1440,123-73-9,CL,Crotonaldehyde,-0.01,0.01,-0.01,4,1,,,,,,,
TWSCLS20142504,TW,25/4/2014,2014,4,25,0.7047,1440,78-93-3,CL,Methyl ethyl ketone,2.8,2.76,2.7,4,1,,,,,,,
TWSCLS20142504,TW,25/4/2014,2014,4,25,0.7047,1440,123-72-8,CL,Butyraldehyde/IBA,0.76,0.75,0.75,4,1,,,,,,,
TWSCLS20142504,TW,25/4/2014,2014,4,25,0.7047,1440,100-52-7,CL,Benzaldehyde,5.1,5.03,5.1,4,1,,,,,,,
TWSCLS20142504,TW,25/4/2014,2014,4,25,0.7047,1440,590-86-3,CL,Isovaleraldehyde,-0.01,0.01,-0.01,4,1,,,,,,,
TWSCLS20142504,TW,25/4/2014,2014,4,25,0.7047,1440,110-62-3,CL,Valeraldehyde,1.1,1.08,1.1,4,1,,,,,,,
TWSCLS20142504,TW,25/4/2014,2014,4,25,0.7047,1440,529-20-4,CL,o-Tolualdehyde,-0.01,0.01,-0.01,4,1,,,,,,,
TWSCLS20142504,TW,25/4/2014,2014,4,25,0.7047,1440,620-23-5,CL,m-Tolualdehyde,-0.01,0.01,-0.01,4,1,,,,,,,
TWSCLS20142504,TW,25/4/2014,2014,4,25,0.7047,1440,104-87-0,CL,p-Tolualdehyde,-0.01,0.01,-0.01,4,1,,,,,,,
TWSCLS20142504,TW,25/4/2014,2014,4,25,0.7047,1440,66-25-1,CL,Hexaldehyde,0.93,0.92,0.92,4,1,,,,,,,
TWSCLS20142504,TW,25/4/2014,2014,4,25,0.7047,1440,5779-94-2,CL,"2,5-Dimethylbenzaldehyde",-0.01,0.01,-0.01,4,1,,,,,,,
CWSCLS20140705,CW,7/5/2014,2014,5,7,0.6965,1440,50-00-0,CL,Formaldehyde,2.1,2.09,2.1,4,1,,,,,,,
CWSCLS20140705,CW,7/5/2014,2014,5,7,0.6965,1440,75-07-0,CL,Acetaldehyde,1.3,1.3,1.3,4,1,,,,,,,
CWSCLS20140705,CW,7/5/2014,2014,5,7,0.6965,1440,107-02-8,CL,Acrolein,-0.01,0.01,-0.01,4,1,,,,,,,
CWSCLS20140705,CW,7/5/2014,2014,5,7,0.6965,1440,67-64-1,CL,Acetone,0.85,0.85,0.84,4,1,,,,,,,
CWSCLS20140705,CW,7/5/2014,2014,5,7,0.6965,1440,123-38-6,CL,Propionaldehyde,0.04,0.04,0.04,4,1,,,,,,,
CWSCLS20140705,CW,7/5/2014,2014,5,7,0.6965,1440,123-73-9,CL,Crotonaldehyde,-0.01,0.01,-0.01,4,1,,,,,,,
CWSCLS20140705,CW,7/5/2014,2014,5,7,0.6965,1440,78-93-3,CL,Methyl ethyl ketone,0.55,0.55,0.55,4,1,,,,,,,
CWSCLS20140705,CW,7/5/2014,2014,5,7,0.6965,1440,123-72-8,CL,Butyraldehyde/IBA,-0.01,0.01,-0.01,4,1,,,,,,,
CWSCLS20140705,CW,7/5/2014,2014,5,7,0.6965,1440,100-52-7,CL,Benzaldehyde,0.4,0.4,0.04,4,1,,,,,,,
CWSCLS20140705,CW,7/5/2014,2014,5,7,0.6965,1440,590-86-3,CL,Isovaleraldehyde,-0.01,0.01,-0.01,4,1,,,,,,,
CWSCLS20140705,CW,7/5/2014,2014,5,7,0.6965,1440,110-62-3,CL,Valeraldehyde,-0.01,0.01,-0.01,4,1,,,,,,,
CWSCLS20140705,CW,7/5/2014,2014,5,7,0.6965,1440,529-20-4,CL,o-Tolualdehyde,-0.01,0.01,-0.01,4,1,,,,,,,
CWSCLS20140705,CW,7/5/2014,2014,5,7,0.6965,1440,620-23-5,CL,m-Tolualdehyde,-0.01,0.01,-0.01,4,1,,,,,,,
CWSCLS20140705,CW,7/5/2014,2014,5,7,0.6965,1440,104-87-0,CL,p-Tolualdehyde,-0.01,0.01,-0.01,4,1,,,,,,,
CWSCLS20140705,CW,7/5/2014,2014,5,7,0.6965,1440,66-25-1,CL,Hexaldehyde,0.05,0.05,0.05,4,1,,,,,,,
CWSCLS20140705,CW,7/5/2014,2014,5,7,0.6965,1440,5779-94-2,CL,"2,5-Dimethylbenzaldehyde",-0.01,0.01,-0.01,4,1,,,,,,,
TWSCLS20141905,TW,19/5/2014,2014,5,19,0.743,1440,50-00-0,CL,Formaldehyde,7.4,6.92,6.9,4,1,,,,,,,
TWSCLS20141905,TW,19/5/2014,2014,5,19,0.743,1440,75-07-0,CL,Acetaldehyde,1.8,1.68,1.7,4,1,,,,,,,
TWSCLS20141905,TW,19/5/2014,2014,5,19,0.743,1440,107-02-8,CL,Acrolein,-0.01,0.01,-0.01,4,1,,,,,,,
TWSCLS20141905,TW,19/5/2014,2014,5,19,0.743,1440,67-64-1,CL,Acetone,0.55,0.51,0.51,4,1,,,,,,,
TWSCLS20141905,TW,19/5/2014,2014,5,19,0.743,1440,123-38-6,CL,Propionaldehyde,0.18,0.17,0.17,4,1,,,,,,,
TWSCLS20141905,TW,19/5/2014,2014,5,19,0.743,1440,123-73-9,CL,Crotonaldehyde,-0.01,0.01,-0.01,4,1,,,,,,,
TWSCLS20141905,TW,19/5/2014,2014,5,19,0.743,1440,78-93-3,CL,Methyl ethyl ketone,2.5,2.34,2.3,4,1,,,,,,,
TWSCLS20141905,TW,19/5/2014,2014,5,19,0.743,1440,123-72-8,CL,Butyraldehyde/IBA,0.34,0.32,0.31,4,1,,,,,,,
TWSCLS20141905,TW,19/5/2014,2014,5,19,0.743,1440,100-52-7,CL,Benzaldehyde,2.3,2.15,2.1,4,1,,,,,,,
TWSCLS20141905,TW,19/5/2014,2014,5,19,0.743,1440,590-86-3,CL,Isovaleraldehyde,-0.01,0.01,-0.01,4,1,,,,,,,
TWSCLS20141905,TW,19/5/2014,2014,5,19,0.743,1440,110-62-3,CL,Valeraldehyde,0.19,0.18,0.18,4,1,,,,,,,
TWSCLS20141905,TW,19/5/2014,2014,5,19,0.743,1440,529-20-4,CL,o-Tolualdehyde,-0.01,0.01,-0.01,4,1,,,,,,,
TWSCLS20141905,TW,19/5/2014,2014,5,19,0.743,1440,620-23-5,CL,m-Tolualdehyde,-0.01,0.01,-0.01,4,1,,,,,,,
TWSCLS20141905,TW,19/5/2014,2014,5,19,0.743,1440,104-87-0,CL,p-Tolualdehyde,-0.01,0.01,-0.01,4,1,,,,,,,
TWSCLS20141905,TW,19/5/2014,2014,5,19,0.743,1440,66-25-1,CL,Hexaldehyde,0.3,0.28,0.28,4,1,,,,,,,
TWSCLS20141905,TW,19/5/2014,2014,5,19,0.743,1440,5779-94-2,CL,"2,5-Dimethylbenzaldehyde",-0.01,0.01,-0.01,4,1,,,,,,,
CWSCLS20141806A1,CW,18/6/2014,2014,6,18,0.6969,1440,50-00-0,CL,Formaldehyde,2.1,2.09,2.1,4,1,,,,,,,
CWSCLS20141806A1,CW,18/6/2014,2014,6,18,0.6969,1440,75-07-0,CL,Acetaldehyde,1.3,1.3,1.3,4,1,,,,,,,
CWSCLS20141806A1,CW,18/6/2014,2014,6,18,0.6969,1440,107-02-8,CL,Acrolein,-0.01,0.01,-0.01,4,1,,,,,,,
CWSCLS20141806A1,CW,18/6/2014,2014,6,18,0.6969,1440,67-64-1,CL,Acetone,1,1,1,4,1,,,,,,,
CWSCLS20141806A1,CW,18/6/2014,2014,6,18,0.6969,1440,123-38-6,CL,Propionaldehyde,-0.01,0.01,-0.01,4,1,,,,,,,
CWSCLS20141806A1,CW,18/6/2014,2014,6,18,0.6969,1440,123-73-9,CL,Crotonaldehyde,-0.01,0.01,-0.01,4,1,,,,,,,
CWSCLS20141806A1,CW,18/6/2014,2014,6,18,0.6969,1440,78-93-3,CL,Methyl ethyl ketone,0.68,0.68,0.67,4,1,,,,,,,
CWSCLS20141806A1,CW,18/6/2014,2014,6,18,0.6969,1440,123-72-8,CL,Butyraldehyde/IBA,-0.01,0.01,-0.01,4,1,,,,,,,
CWSCLS20141806A1,CW,18/6/2014,2014,6,18,0.6969,1440,100-52-7,CL,Benzaldehyde,0.39,0.39,0.39,4,1,,,,,,,
CWSCLS20141806A1,CW,18/6/2014,2014,6,18,0.6969,1440,590-86-3,CL,Isovaleraldehyde,-0.01,0.01,-0.01,4,1,,,,,,,
CWSCLS20141806A1,CW,18/6/2014,2014,6,18,0.6969,1440,110-62-3,CL,Valeraldehyde,0.14,0.14,0.14,4,1,,,,,,,
CWSCLS20141806A1,CW,18/6/2014,2014,6,18,0.6969,1440,529-20-4,CL,o-Tolualdehyde,-0.01,0.01,-0.01,4,1,,,,,,,
CWSCLS20141806A1,CW,18/6/2014,2014,6,18,0.6969,1440,620-23-5,CL,m-Tolualdehyde,-0.01,0.01,-0.01,4,1,,,,,,,
CWSCLS20141806A1,CW,18/6/2014,2014,6,18,0.6969,1440,104-87-0,CL,p-Tolualdehyde,-0.01,0.01,-0.01,4,1,,,,,,,
CWSCLS20141806A1,CW,18/6/2014,2014,6,18,0.6969,1440,66-25-1,CL,Hexaldehyde,0.05,0.05,0.05,4,1,,,,,,,
CWSCLS20141806A1,CW,18/6/2014,2014,6,18,0.6969,1440,5779-94-2,CL,"2,5-Dimethylbenzaldehyde",0.13,0.13,0.13,4,1,,,,,,,
CWSCLS20141806A2,CW,18/6/2014,2014,6,18,0.6927,1440,50-00-0,CL,Formaldehyde,2.1,2.11,2.1,4,0,Co-location,,,,,,
CWSCLS20141806A2,CW,18/6/2014,2014,6,18,0.6927,1440,75-07-0,CL,Acetaldehyde,1.3,1.3,1.3,4,0,Co-location,,,,,,
CWSCLS20141806A2,CW,18/6/2014,2014,6,18,0.6927,1440,107-02-8,CL,Acrolein,-0.01,0.01,-0.01,4,0,Co-location,,,,,,
CWSCLS20141806A2,CW,18/6/2014,2014,6,18,0.6927,1440,67-64-1,CL,Acetone,1,1,1,4,0,Co-location,,,,,,
CWSCLS20141806A2,CW,18/6/2014,2014,6,18,0.6927,1440,123-38-6,CL,Propionaldehyde,-0.01,0.01,-0.01,4,0,Co-location,,,,,,
CWSCLS20141806A2,CW,18/6/2014,2014,6,18,0.6927,1440,123-73-9,CL,Crotonaldehyde,-0.01,0.01,-0.01,4,0,Co-location,,,,,,
CWSCLS20141806A2,CW,18/6/2014,2014,6,18,0.6927,1440,78-93-3,CL,Methyl ethyl ketone,0.72,0.72,0.72,4,0,Co-location,,,,,,
CWSCLS20141806A2,CW,18/6/2014,2014,6,18,0.6927,1440,123-72-8,CL,Butyraldehyde/IBA,-0.01,0.01,-0.01,4,0,Co-location,,,,,,
CWSCLS20141806A2,CW,18/6/2014,2014,6,18,0.6927,1440,100-52-7,CL,Benzaldehyde,0.39,0.39,0.39,4,0,Co-location,,,,,,
CWSCLS20141806A2,CW,18/6/2014,2014,6,18,0.6927,1440,590-86-3,CL,Isovaleraldehyde,-0.01,0.01,-0.01,4,0,Co-location,,,,,,
CWSCLS20141806A2,CW,18/6/2014,2014,6,18,0.6927,1440,110-62-3,CL,Valeraldehyde,0.12,0.12,0.12,4,0,Co-location,,,,,,
CWSCLS20141806A2,CW,18/6/2014,2014,6,18,0.6927,1440,529-20-4,CL,o-Tolualdehyde,-0.01,0.01,-0.01,4,0,Co-location,,,,,,
CWSCLS20141806A2,CW,18/6/2014,2014,6,18,0.6927,1440,620-23-5,CL,m-Tolualdehyde,-0.01,0.01,-0.01,4,0,Co-location,,,,,,
CWSCLS20141806A2,CW,18/6/2014,2014,6,18,0.6927,1440,104-87-0,CL,p-Tolualdehyde,-0.01,0.01,-0.01,4,0,Co-location,,,,,,
CWSCLS20141806A2,CW,18/6/2014,2014,6,18,0.6927,1440,66-25-1,CL,Hexaldehyde,0.05,0.05,0.05,4,0,Co-location,,,,,,
CWSCLS20141806A2,CW,18/6/2014,2014,6,18,0.6927,1440,5779-94-2,CL,"2,5-Dimethylbenzaldehyde",0.13,0.13,0.13,4,0,Co-location,,,,,,
TWSCLS20141206A1,TW,12/6/2014,2014,6,12,0.7599,1440,50-00-0,CL,Formaldehyde,11,10.05,10,4,1,,,,,,,
TWSCLS20141206A1,TW,12/6/2014,2014,6,12,0.7599,1440,75-07-0,CL,Acetaldehyde,3.7,3.38,3.4,4,1,,,,,,,
TWSCLS20141206A1,TW,12/6/2014,2014,6,12,0.7599,1440,107-02-8,CL,Acrolein,-0.01,0.01,-0.01,4,1,,,,,,,
TWSCLS20141206A1,TW,12/6/2014,2014,6,12,0.7599,1440,67-64-1,CL,Acetone,5.6,5.12,5.1,4,1,,,,,,,
TWSCLS20141206A1,TW,12/6/2014,2014,6,12,0.7599,1440,123-38-6,CL,Propionaldehyde,0.42,0.38,0.38,4,1,,,,,,,
TWSCLS20141206A1,TW,12/6/2014,2014,6,12,0.7599,1440,123-73-9,CL,Crotonaldehyde,-0.01,0.01,-0.01,4,1,,,,,,,
TWSCLS20141206A1,TW,12/6/2014,2014,6,12,0.7599,1440,78-93-3,CL,Methyl ethyl ketone,3.8,3.47,3.5,4,1,,,,,,,
TWSCLS20141206A1,TW,12/6/2014,2014,6,12,0.7599,1440,123-72-8,CL,Butyraldehyde/IBA,0.32,0.29,0.3,4,1,,,,,,,
TWSCLS20141206A1,TW,12/6/2014,2014,6,12,0.7599,1440,100-52-7,CL,Benzaldehyde,3.3,3.02,3,4,1,,,,,,,
TWSCLS20141206A1,TW,12/6/2014,2014,6,12,0.7599,1440,590-86-3,CL,Isovaleraldehyde,-0.01,0.01,-0.01,4,1,,,,,,,
TWSCLS20141206A1,TW,12/6/2014,2014,6,12,0.7599,1440,110-62-3,CL,Valeraldehyde,0.52,0.48,0.48,4,1,,,,,,,
TWSCLS20141206A1,TW,12/6/2014,2014,6,12,0.7599,1440,529-20-4,CL,o-Tolualdehyde,-0.01,0.01,-0.01,4,1,,,,,,,
TWSCLS20141206A1,TW,12/6/2014,2014,6,12,0.7599,1440,620-23-5,CL,m-Tolualdehyde,-0.01,0.01,-0.01,4,1,,,,,,,
TWSCLS20141206A1,TW,12/6/2014,2014,6,12,0.7599,1440,104-87-0,CL,p-Tolualdehyde,-0.01,0.01,-0.01,4,1,,,,,,,
TWSCLS20141206A1,TW,12/6/2014,2014,6,12,0.7599,1440,66-25-1,CL,Hexaldehyde,0.45,0.41,0.41,4,1,,,,,,,
TWSCLS20141206A1,TW,12/6/2014,2014,6,12,0.7599,1440,5779-94-2,CL,"2,5-Dimethylbenzaldehyde",-0.01,0.01,-0.01,4,1,,,,,,,
TWSCLS20141206A2,TW,12/6/2014,2014,6,12,0.7587,1440,50-00-0,CL,Formaldehyde,11,10.07,10,4,0,Co-location,,,,,,
TWSCLS20141206A2,TW,12/6/2014,2014,6,12,0.7587,1440,75-07-0,CL,Acetaldehyde,3.6,3.3,3.3,4,0,Co-location,,,,,,
TWSCLS20141206A2,TW,12/6/2014,2014,6,12,0.7587,1440,107-02-8,CL,Acrolein,-0.01,0.01,-0.01,4,0,Co-location,,,,,,
TWSCLS20141206A2,TW,12/6/2014,2014,6,12,0.7587,1440,67-64-1,CL,Acetone,6.5,5.95,5.9,4,0,Co-location,,,,,,
TWSCLS20141206A2,TW,12/6/2014,2014,6,12,0.7587,1440,123-38-6,CL,Propionaldehyde,0.37,3.39,0.33,4,0,Co-location,,,,,,
TWSCLS20141206A2,TW,12/6/2014,2014,6,12,0.7587,1440,123-73-9,CL,Crotonaldehyde,-0.01,0.01,-0.01,4,0,Co-location,,,,,,
TWSCLS20141206A2,TW,12/6/2014,2014,6,12,0.7587,1440,78-93-3,CL,Methyl ethyl ketone,3.5,3.2,3.2,4,0,Co-location,,,,,,
TWSCLS20141206A2,TW,12/6/2014,2014,6,12,0.7587,1440,123-72-8,CL,Butyraldehyde/IBA,0.35,0.32,0.32,4,0,Co-location,,,,,,
TWSCLS20141206A2,TW,12/6/2014,2014,6,12,0.7587,1440,100-52-7,CL,Benzaldehyde,3.2,2.93,2.9,4,0,Co-location,,,,,,
TWSCLS20141206A2,TW,12/6/2014,2014,6,12,0.7587,1440,590-86-3,CL,Isovaleraldehyde,-0.01,0.01,-0.01,4,0,Co-location,,,,,,
TWSCLS20141206A2,TW,12/6/2014,2014,6,12,0.7587,1440,110-62-3,CL,Valeraldehyde,0.58,0.53,0.53,4,0,Co-location,,,,,,
TWSCLS20141206A2,TW,12/6/2014,2014,6,12,0.7587,1440,529-20-4,CL,o-Tolualdehyde,-0.01,0.01,-0.01,4,0,Co-location,,,,,,
TWSCLS20141206A2,TW,12/6/2014,2014,6,12,0.7587,1440,620-23-5,CL,m-Tolualdehyde,-0.01,0.01,-0.01,4,0,Co-location,,,,,,
TWSCLS20141206A2,TW,12/6/2014,2014,6,12,0.7587,1440,104-87-0,CL,p-Tolualdehyde,-0.01,0.01,-0.01,4,0,Co-location,,,,,,
TWSCLS20141206A2,TW,12/6/2014,2014,6,12,0.7587,1440,66-25-1,CL,Hexaldehyde,0.41,0.38,0.37,4,0,Co-location,,,,,,
TWSCLS20141206A2,TW,12/6/2014,2014,6,12,0.7587,1440,5779-94-2,CL,"2,5-Dimethylbenzaldehyde",-0.01,0.01,-0.01,4,0,Co-location,,,,,,
CWSCLS20140607,CW,6/7/2014,2014,7,6,0.6969,1440,50-00-0,CL,Formaldehyde,2.9,2.89,2.9,4,1,,,,,,,
CWSCLS20140607,CW,6/7/2014,2014,7,6,0.6969,1440,75-07-0,CL,Acetaldehyde,0.9,0.9,0.9,4,1,,,,,,,
CWSCLS20140607,CW,6/7/2014,2014,7,6,0.6969,1440,107-02-8,CL,Acrolein,-0.01,0.01,-0.01,4,1,,,,,,,
CWSCLS20140607,CW,6/7/2014,2014,7,6,0.6969,1440,67-64-1,CL,Acetone,2.5,2.49,2.5,4,1,,,,,,,
CWSCLS20140607,CW,6/7/2014,2014,7,6,0.6969,1440,123-38-6,CL,Propionaldehyde,0.13,0.13,0.13,4,1,,,,,,,
CWSCLS20140607,CW,6/7/2014,2014,7,6,0.6969,1440,123-73-9,CL,Crotonaldehyde,-0.01,0.01,-0.01,4,1,,,,,,,
CWSCLS20140607,CW,6/7/2014,2014,7,6,0.6969,1440,78-93-3,CL,Methyl ethyl ketone,0.43,0.43,0.42,4,1,,,,,,,
CWSCLS20140607,CW,6/7/2014,2014,7,6,0.6969,1440,123-72-8,CL,Butyraldehyde/IBA,-0.01,0.01,-0.01,4,1,,,,,,,
CWSCLS20140607,CW,6/7/2014,2014,7,6,0.6969,1440,100-52-7,CL,Benzaldehyde,-0.01,0.01,-0.01,4,1,,,,,,,
CWSCLS20140607,CW,6/7/2014,2014,7,6,0.6969,1440,590-86-3,CL,Isovaleraldehyde,-0.01,0.01,-0.01,4,1,,,,,,,
CWSCLS20140607,CW,6/7/2014,2014,7,6,0.6969,1440,110-62-3,CL,Valeraldehyde,-0.01,0.01,-0.01,4,1,,,,,,,
CWSCLS20140607,CW,6/7/2014,2014,7,6,0.6969,1440,529-20-4,CL,o-Tolualdehyde,-0.01,0.01,-0.01,4,1,,,,,,,
CWSCLS20140607,CW,6/7/2014,2014,7,6,0.6969,1440,620-23-5,CL,m-Tolualdehyde,-0.01,0.01,-0.01,4,1,,,,,,,
CWSCLS20140607,CW,6/7/2014,2014,7,6,0.6969,1440,104-87-0,CL,p-Tolualdehyde,-0.01,0.01,-0.01,4,1,,,,,,,
CWSCLS20140607,CW,6/7/2014,2014,7,6,0.6969,1440,66-25-1,CL,Hexaldehyde,0.16,0.16,0.16,4,1,,,,,,,
CWSCLS20140607,CW,6/7/2014,2014,7,6,0.6969,1440,5779-94-2,CL,"2,5-Dimethylbenzaldehyde",0.08,0.08,0.08,4,1,,,,,,,
TWSCLS20142907,TW,29/7/2014,2014,7,29,0.6975,1440,50-00-0,CL,Formaldehyde,5.4,5.38,5.4,4,1,,,,,,,
TWSCLS20142907,TW,29/7/2014,2014,7,29,0.6975,1440,75-07-0,CL,Acetaldehyde,2,1.99,2,4,1,,,,,,,
TWSCLS20142907,TW,29/7/2014,2014,7,29,0.6975,1440,107-02-8,CL,Acrolein,-0.01,0.01,-0.01,4,1,,,,,,,
TWSCLS20142907,TW,29/7/2014,2014,7,29,0.6975,1440,67-64-1,CL,Acetone,1,1,1,4,1,,,,,,,
TWSCLS20142907,TW,29/7/2014,2014,7,29,0.6975,1440,123-38-6,CL,Propionaldehyde,0.45,0.45,0.45,4,1,,,,,,,
TWSCLS20142907,TW,29/7/2014,2014,7,29,0.6975,1440,123-73-9,CL,Crotonaldehyde,-0.01,0.01,-0.01,4,1,,,,,,,
TWSCLS20142907,TW,29/7/2014,2014,7,29,0.6975,1440,78-93-3,CL,Methyl ethyl ketone,1.7,1.69,1.7,4,1,,,,,,,
TWSCLS20142907,TW,29/7/2014,2014,7,29,0.6975,1440,123-72-8,CL,Butyraldehyde/IBA,0.62,0.62,0.62,4,1,,,,,,,
TWSCLS20142907,TW,29/7/2014,2014,7,29,0.6975,1440,100-52-7,CL,Benzaldehyde,1.3,1.29,1.3,4,1,,,,,,,
TWSCLS20142907,TW,29/7/2014,2014,7,29,0.6975,1440,590-86-3,CL,Isovaleraldehyde,0.12,0.12,0.12,4,1,,,,,,,
TWSCLS20142907,TW,29/7/2014,2014,7,29,0.6975,1440,110-62-3,CL,Valeraldehyde,0.26,0.26,0.26,4,1,,,,,,,
TWSCLS20142907,TW,29/7/2014,2014,7,29,0.6975,1440,529-20-4,CL,o-Tolualdehyde,-0.01,0.01,-0.01,4,1,,,,,,,
TWSCLS20142907,TW,29/7/2014,2014,7,29,0.6975,1440,620-23-5,CL,m-Tolualdehyde,-0.01,0.01,-0.01,4,1,,,,,,,
TWSCLS20142907,TW,29/7/2014,2014,7,29,0.6975,1440,104-87-0,CL,p-Tolualdehyde,-0.01,0.01,-0.01,4,1,,,,,,,
TWSCLS20142907,TW,29/7/2014,2014,7,29,0.6975,1440,66-25-1,CL,Hexaldehyde,0.32,0.32,0.32,4,1,,,,,,,
TWSCLS20142907,TW,29/7/2014,2014,7,29,0.6975,1440,5779-94-2,CL,"2,5-Dimethylbenzaldehyde",-0.01,0.01,-0.01,4,1,,,,,,,
CWSCLS20141708,CW,17/8/2014,2014,8,17,0.694,1440,50-00-0,CL,Formaldehyde,2.3,2.3,2.3,4,1,,,,,,,
CWSCLS20141708,CW,17/8/2014,2014,8,17,0.694,1440,75-07-0,CL,Acetaldehyde,0.67,0.67,0.67,4,1,,,,,,,
CWSCLS20141708,CW,17/8/2014,2014,8,17,0.694,1440,107-02-8,CL,Acrolein,-0.01,0.01,-0.01,4,1,,,,,,,
CWSCLS20141708,CW,17/8/2014,2014,8,17,0.694,1440,67-64-1,CL,Acetone,1.9,1.9,1.9,4,1,,,,,,,
CWSCLS20141708,CW,17/8/2014,2014,8,17,0.694,1440,123-38-6,CL,Propionaldehyde,0.07,0.07,0.07,4,1,,,,,,,
CWSCLS20141708,CW,17/8/2014,2014,8,17,0.694,1440,123-73-9,CL,Crotonaldehyde,-0.01,0.01,-0.01,4,1,,,,,,,
CWSCLS20141708,CW,17/8/2014,2014,8,17,0.694,1440,78-93-3,CL,Methyl ethyl ketone,1.5,1.5,1.5,4,1,,,,,,,
CWSCLS20141708,CW,17/8/2014,2014,8,17,0.694,1440,123-72-8,CL,Butyraldehyde/IBA,-0.01,0.01,-0.01,4,1,,,,,,,
CWSCLS20141708,CW,17/8/2014,2014,8,17,0.694,1440,100-52-7,CL,Benzaldehyde,0.11,0.11,0.11,4,1,,,,,,,
CWSCLS20141708,CW,17/8/2014,2014,8,17,0.694,1440,590-86-3,CL,Isovaleraldehyde,-0.01,0.01,-0.01,4,1,,,,,,,
CWSCLS20141708,CW,17/8/2014,2014,8,17,0.694,1440,110-62-3,CL,Valeraldehyde,0.08,0.08,0.08,4,1,,,,,,,
CWSCLS20141708,CW,17/8/2014,2014,8,17,0.694,1440,529-20-4,CL,o-Tolualdehyde,-0.01,0.01,-0.01,4,1,,,,,,,
CWSCLS20141708,CW,17/8/2014,2014,8,17,0.694,1440,620-23-5,CL,m-Tolualdehyde,-0.01,0.01,-0.01,4,1,,,,,,,
CWSCLS20141708,CW,17/8/2014,2014,8,17,0.694,1440,104-87-0,CL,p-Tolualdehyde,-0.01,0.01,-0.01,4,1,,,,,,,
CWSCLS20141708,CW,17/8/2014,2014,8,17,0.694,1440,66-25-1,CL,Hexaldehyde,0.06,0.06,0.06,4,1,,,,,,,
CWSCLS20141708,CW,17/8/2014,2014,8,17,0.694,1440,5779-94-2,CL,"2,5-Dimethylbenzaldehyde",-0.01,0.01,-0.01,4,1,,,,,,,
TWSCLS20140508,TW,5/8/2014,2014,8,5,0.7015,1440,50-00-0,CL,Formaldehyde,2.5,2.47,2.4,4,1,,,,,,,
TWSCLS20140508,TW,5/8/2014,2014,8,5,0.7015,1440,75-07-0,CL,Acetaldehyde,1.5,1.48,1.4,4,1,,,,,,,
TWSCLS20140508,TW,5/8/2014,2014,8,5,0.7015,1440,107-02-8,CL,Acrolein,-0.01,0.01,-0.01,4,1,,,,,,,
TWSCLS20140508,TW,5/8/2014,2014,8,5,0.7015,1440,67-64-1,CL,Acetone,0.74,0.73,0.73,4,1,,,,,,,
TWSCLS20140508,TW,5/8/2014,2014,8,5,0.7015,1440,123-38-6,CL,Propionaldehyde,0.47,0.47,0.47,4,1,,,,,,,
TWSCLS20140508,TW,5/8/2014,2014,8,5,0.7015,1440,123-73-9,CL,Crotonaldehyde,-0.01,0.01,-0.01,4,1,,,,,,,
TWSCLS20140508,TW,5/8/2014,2014,8,5,0.7015,1440,78-93-3,CL,Methyl ethyl ketone,0.58,0.57,0.58,4,1,,,,,,,
TWSCLS20140508,TW,5/8/2014,2014,8,5,0.7015,1440,123-72-8,CL,Butyraldehyde/IBA,0.48,0.48,0.48,4,1,,,,,,,
TWSCLS20140508,TW,5/8/2014,2014,8,5,0.7015,1440,100-52-7,CL,Benzaldehyde,0.52,0.51,0.51,4,1,,,,,,,
TWSCLS20140508,TW,5/8/2014,2014,8,5,0.7015,1440,590-86-3,CL,Isovaleraldehyde,0.03,0.03,0.03,4,1,,,,,,,
TWSCLS20140508,TW,5/8/2014,2014,8,5,0.7015,1440,110-62-3,CL,Valeraldehyde,0.27,0.27,0.27,4,1,,,,,,,
TWSCLS20140508,TW,5/8/2014,2014,8,5,0.7015,1440,529-20-4,CL,o-Tolualdehyde,-0.01,0.01,-0.01,4,1,,,,,,,
TWSCLS20140508,TW,5/8/2014,2014,8,5,0.7015,1440,620-23-5,CL,m-Tolualdehyde,-0.01,0.01,-0.01,4,1,,,,,,,
TWSCLS20140508,TW,5/8/2014,2014,8,5,0.7015,1440,104-87-0,CL,p-Tolualdehyde,-0.01,0.01,-0.01,4,1,,,,,,,
TWSCLS20140508,TW,5/8/2014,2014,8,5,0.7015,1440,66-25-1,CL,Hexaldehyde,0.28,0.28,0.27,4,1,,,,,,,
TWSCLS20140508,TW,5/8/2014,2014,8,5,0.7015,1440,5779-94-2,CL,"2,5-Dimethylbenzaldehyde",-0.01,0.01,-0.01,4,1,,,,,,,
CWSCLS20142209A1,CW,22/9/2014,2014,9,22,0.6924,1440,50-00-0,CL,Formaldehyde,4.5,4.51,4.5,4,1,,,,,,,
CWSCLS20142209A1,CW,22/9/2014,2014,9,22,0.6924,1440,75-07-0,CL,Acetaldehyde,2.1,2.11,2.1,4,1,,,,,,,
CWSCLS20142209A1,CW,22/9/2014,2014,9,22,0.6924,1440,107-02-8,CL,Acrolein,-0.01,0.01,-0.01,4,1,,,,,,,
CWSCLS20142209A1,CW,22/9/2014,2014,9,22,0.6924,1440,67-64-1,CL,Acetone,0.53,0.53,0.53,4,1,,,,,,,
CWSCLS20142209A1,CW,22/9/2014,2014,9,22,0.6924,1440,123-38-6,CL,Propionaldehyde,-0.01,0.01,-0.01,4,1,,,,,,,
CWSCLS20142209A1,CW,22/9/2014,2014,9,22,0.6924,1440,123-73-9,CL,Crotonaldehyde,-0.01,0.01,-0.01,4,1,,,,,,,
CWSCLS20142209A1,CW,22/9/2014,2014,9,22,0.6924,1440,78-93-3,CL,Methyl ethyl ketone,0.52,0.52,0.52,4,1,,,,,,,
CWSCLS20142209A1,CW,22/9/2014,2014,9,22,0.6924,1440,123-72-8,CL,Butyraldehyde/IBA,0.09,0.09,0.09,4,1,,,,,,,
CWSCLS20142209A1,CW,22/9/2014,2014,9,22,0.6924,1440,100-52-7,CL,Benzaldehyde,0.37,0.37,0.37,4,1,,,,,,,
CWSCLS20142209A1,CW,22/9/2014,2014,9,22,0.6924,1440,590-86-3,CL,Isovaleraldehyde,-0.01,0.01,-0.01,4,1,,,,,,,
CWSCLS20142209A1,CW,22/9/2014,2014,9,22,0.6924,1440,110-62-3,CL,Valeraldehyde,-0.01,0.01,-0.01,4,1,,,,,,,
CWSCLS20142209A1,CW,22/9/2014,2014,9,22,0.6924,1440,529-20-4,CL,o-Tolualdehyde,-0.01,0.01,-0.01,4,1,,,,,,,
CWSCLS20142209A1,CW,22/9/2014,2014,9,22,0.6924,1440,620-23-5,CL,m-Tolualdehyde,-0.01,0.01,-0.01,4,1,,,,,,,
CWSCLS20142209A1,CW,22/9/2014,2014,9,22,0.6924,1440,104-87-0,CL,p-Tolualdehyde,1.3,1.3,1.3,4,1,,,,,,,
CWSCLS20142209A1,CW,22/9/2014,2014,9,22,0.6924,1440,66-25-1,CL,Hexaldehyde,-0.01,0.01,-0.01,4,1,,,,,,,
CWSCLS20142209A1,CW,22/9/2014,2014,9,22,0.6924,1440,5779-94-2,CL,"2,5-Dimethylbenzaldehyde",-0.01,0.01,-0.01,4,1,,,,,,,
CWSCLS20142209A2,CW,22/9/2014,2014,9,22,0.6951,1440,50-00-0,CL,Formaldehyde,4.7,4.7,4.7,4,0,Co-location,,,,,,
CWSCLS20142209A2,CW,22/9/2014,2014,9,22,0.6951,1440,75-07-0,CL,Acetaldehyde,2.1,2.1,2,4,0,Co-location,,,,,,
CWSCLS20142209A2,CW,22/9/2014,2014,9,22,0.6951,1440,107-02-8,CL,Acrolein,-0.01,0.01,-0.01,4,0,Co-location,,,,,,
CWSCLS20142209A2,CW,22/9/2014,2014,9,22,0.6951,1440,67-64-1,CL,Acetone,0.66,0.66,0.66,4,0,Co-location,,,,,,
CWSCLS20142209A2,CW,22/9/2014,2014,9,22,0.6951,1440,123-38-6,CL,Propionaldehyde,-0.01,0.01,-0.01,4,0,Co-location,,,,,,
CWSCLS20142209A2,CW,22/9/2014,2014,9,22,0.6951,1440,123-73-9,CL,Crotonaldehyde,-0.01,0.01,-0.01,4,0,Co-location,,,,,,
CWSCLS20142209A2,CW,22/9/2014,2014,9,22,0.6951,1440,78-93-3,CL,Methyl ethyl ketone,0.59,0.59,0.59,4,0,Co-location,,,,,,
CWSCLS20142209A2,CW,22/9/2014,2014,9,22,0.6951,1440,123-72-8,CL,Butyraldehyde/IBA,0.1,0.1,0.1,4,0,Co-location,,,,,,
CWSCLS20142209A2,CW,22/9/2014,2014,9,22,0.6951,1440,100-52-7,CL,Benzaldehyde,0.31,0.31,0.31,4,0,Co-location,,,,,,
CWSCLS20142209A2,CW,22/9/2014,2014,9,22,0.6951,1440,590-86-3,CL,Isovaleraldehyde,-0.01,0.01,-0.01,4,0,Co-location,,,,,,
CWSCLS20142209A2,CW,22/9/2014,2014,9,22,0.6951,1440,110-62-3,CL,Valeraldehyde,-0.01,0.01,-0.01,4,0,Co-location,,,,,,
CWSCLS20142209A2,CW,22/9/2014,2014,9,22,0.6951,1440,529-20-4,CL,o-Tolualdehyde,-0.01,0.01,-0.01,4,0,Co-location,,,,,,
CWSCLS20142209A2,CW,22/9/2014,2014,9,22,0.6951,1440,620-23-5,CL,m-Tolualdehyde,-0.01,0.01,-0.01,4,0,Co-location,,,,,,
CWSCLS20142209A2,CW,22/9/2014,2014,9,22,0.6951,1440,104-87-0,CL,p-Tolualdehyde,1.3,1.3,1.3,4,0,Co-location,,,,,,
CWSCLS20142209A2,CW,22/9/2014,2014,9,22,0.6951,1440,66-25-1,CL,Hexaldehyde,-0.01,0.01,-0.01,4,0,Co-location,,,,,,
CWSCLS20142209A2,CW,22/9/2014,2014,9,22,0.6951,1440,5779-94-2,CL,"2,5-Dimethylbenzaldehyde",-0.01,0.01,-0.01,4,0,Co-location,,,,,,
TWSCLS20141609A1,TW,16/9/2014,2014,9,16,0.7014,1440,50-00-0,CL,Formaldehyde,2.6,2.57,2.5,4,1,,,,,,,
TWSCLS20141609A1,TW,16/9/2014,2014,9,16,0.7014,1440,75-07-0,CL,Acetaldehyde,0.83,0.82,0.82,4,1,,,,,,,
TWSCLS20141609A1,TW,16/9/2014,2014,9,16,0.7014,1440,107-02-8,CL,Acrolein,-0.01,0.01,-0.01,4,1,,,,,,,
TWSCLS20141609A1,TW,16/9/2014,2014,9,16,0.7014,1440,67-64-1,CL,Acetone,0.29,0.29,0.28,4,1,,,,,,,
TWSCLS20141609A1,TW,16/9/2014,2014,9,16,0.7014,1440,123-38-6,CL,Propionaldehyde,0.23,0.23,0.23,4,1,,,,,,,
TWSCLS20141609A1,TW,16/9/2014,2014,9,16,0.7014,1440,123-73-9,CL,Crotonaldehyde,0.04,0.04,0.04,4,1,,,,,,,
TWSCLS20141609A1,TW,16/9/2014,2014,9,16,0.7014,1440,78-93-3,CL,Methyl ethyl ketone,0.38,0.38,0.38,4,1,,,,,,,
TWSCLS20141609A1,TW,16/9/2014,2014,9,16,0.7014,1440,123-72-8,CL,Butyraldehyde/IBA,0.16,0.16,0.16,4,1,,,,,,,
TWSCLS20141609A1,TW,16/9/2014,2014,9,16,0.7014,1440,100-52-7,CL,Benzaldehyde,0.7,0.69,0.69,4,1,,,,,,,
TWSCLS20141609A1,TW,16/9/2014,2014,9,16,0.7014,1440,590-86-3,CL,Isovaleraldehyde,-0.01,0.01,-0.01,4,1,,,,,,,
TWSCLS20141609A1,TW,16/9/2014,2014,9,16,0.7014,1440,110-62-3,CL,Valeraldehyde,0.09,0.09,0.09,4,1,,,,,,,
TWSCLS20141609A1,TW,16/9/2014,2014,9,16,0.7014,1440,529-20-4,CL,o-Tolualdehyde,-0.01,0.01,-0.01,4,1,,,,,,,
TWSCLS20141609A1,TW,16/9/2014,2014,9,16,0.7014,1440,620-23-5,CL,m-Tolualdehyde,-0.01,0.01,-0.01,4,1,,,,,,,
TWSCLS20141609A1,TW,16/9/2014,2014,9,16,0.7014,1440,104-87-0,CL,p-Tolualdehyde,-0.01,0.01,-0.01,4,1,,,,,,,
TWSCLS20141609A1,TW,16/9/2014,2014,9,16,0.7014,1440,66-25-1,CL,Hexaldehyde,0.25,0.25,0.25,4,1,,,,,,,
TWSCLS20141609A1,TW,16/9/2014,2014,9,16,0.7014,1440,5779-94-2,CL,"2,5-Dimethylbenzaldehyde",-0.01,0.01,-0.01,4,1,,,,,,,
TWSCLS20141609A2,TW,16/9/2014,2014,9,16,0.7019,1440,50-00-0,CL,Formaldehyde,2.5,2.47,2.5,4,0,Co-location,,,,,,
TWSCLS20141609A2,TW,16/9/2014,2014,9,16,0.7019,1440,75-07-0,CL,Acetaldehyde,0.82,0.81,0.81,4,0,Co-location,,,,,,
TWSCLS20141609A2,TW,16/9/2014,2014,9,16,0.7019,1440,107-02-8,CL,Acrolein,-0.01,0.01,-0.01,4,0,Co-location,,,,,,
TWSCLS20141609A2,TW,16/9/2014,2014,9,16,0.7019,1440,67-64-1,CL,Acetone,0.28,0.28,0.28,4,0,Co-location,,,,,,
TWSCLS20141609A2,TW,16/9/2014,2014,9,16,0.7019,1440,123-38-6,CL,Propionaldehyde,0.23,0.23,0.23,4,0,Co-location,,,,,,
TWSCLS20141609A2,TW,16/9/2014,2014,9,16,0.7019,1440,123-73-9,CL,Crotonaldehyde,0.05,0.05,0.05,4,0,Co-location,,,,,,
TWSCLS20141609A2,TW,16/9/2014,2014,9,16,0.7019,1440,78-93-3,CL,Methyl ethyl ketone,0.38,0.38,0.38,4,0,Co-location,,,,,,
TWSCLS20141609A2,TW,16/9/2014,2014,9,16,0.7019,1440,123-72-8,CL,Butyraldehyde/IBA,0.16,0.16,0.16,4,0,Co-location,,,,,,
TWSCLS20141609A2,TW,16/9/2014,2014,9,16,0.7019,1440,100-52-7,CL,Benzaldehyde,0.7,0.69,0.7,4,0,Co-location,,,,,,
TWSCLS20141609A2,TW,16/9/2014,2014,9,16,0.7019,1440,590-86-3,CL,Isovaleraldehyde,-0.01,0.01,-0.01,4,0,Co-location,,,,,,
TWSCLS20141609A2,TW,16/9/2014,2014,9,16,0.7019,1440,110-62-3,CL,Valeraldehyde,0.1,0.1,0.1,4,0,Co-location,,,,,,
TWSCLS20141609A2,TW,16/9/2014,2014,9,16,0.7019,1440,529-20-4,CL,o-Tolualdehyde,-0.01,0.01,-0.01,4,0,Co-location,,,,,,
TWSCLS20141609A2,TW,16/9/2014,2014,9,16,0.7019,1440,620-23-5,CL,m-Tolualdehyde,-0.01,0.01,-0.01,4,0,Co-location,,,,,,
TWSCLS20141609A2,TW,16/9/2014,2014,9,16,0.7019,1440,104-87-0,CL,p-Tolualdehyde,-0.01,0.01,-0.01,4,0,Co-location,,,,,,
TWSCLS20141609A2,TW,16/9/2014,2014,9,16,0.7019,1440,66-25-1,CL,Hexaldehyde,0.25,0.25,0.25,4,0,Co-location,,,,,,
TWSCLS20141609A2,TW,16/9/2014,2014,9,16,0.7019,1440,5779-94-2,CL,"2,5-Dimethylbenzaldehyde",-0.01,0.01,-0.01,4,0,Co-location,,,,,,
CWSDFS20142501,CW,25/1/2014,2014,1,25,232,1459,51207-31-9,DF,2378-TCDF,7.1,0.71,0.71,104,1,,,,,,,
CWSDFS20142501,CW,25/1/2014,2014,1,25,232,1459,1746-01-6,DF,2378-TCDD,-0.5,0.25,0.25,104,1,,,,,,,
CWSDFS20142501,CW,25/1/2014,2014,1,25,232,1459,57117-41-6,DF,12378-PeCDF,8.3,0.415,0.415,104,1,,,,,,,
CWSDFS20142501,CW,25/1/2014,2014,1,25,232,1459,57117-31-4,DF,23478-PeCDF,8.3,4.15,4.15,104,1,,,,,,,
CWSDFS20142501,CW,25/1/2014,2014,1,25,232,1459,40321-76-4,DF,12378-PeCDD,-2.5,0.625,0.625,104,1,,,,,,,
CWSDFS20142501,CW,25/1/2014,2014,1,25,232,1459,70648-26-9,DF,123478-HxCDF,7.6,0.76,0.76,104,1,,,,,,,
CWSDFS20142501,CW,25/1/2014,2014,1,25,232,1459,57117-44-9,DF,123678-HxCDF,8.4,0.84,0.84,104,1,,,,,,,
CWSDFS20142501,CW,25/1/2014,2014,1,25,232,1459,60851-34-5,DF,234678-HxCDF,6.9,0.69,0.69,104,1,,,,,,,
CWSDFS20142501,CW,25/1/2014,2014,1,25,232,1459,72918-21-9,DF,123789-HxCDF,-2.5,0.125,0.125,104,1,,,,,,,
CWSDFS20142501,CW,25/1/2014,2014,1,25,232,1459,39227-28-6,DF,123478-HxCDD,-2.5,0.125,0.125,104,1,,,,,,,
CWSDFS20142501,CW,25/1/2014,2014,1,25,232,1459,57653-85-7,DF,123678-HxCDD,4.5,0.45,0.45,104,1,,,,,,,
CWSDFS20142501,CW,25/1/2014,2014,1,25,232,1459,19408-74-3,DF,123789-HxCDD,3.4,0.34,0.34,104,1,,,,,,,
CWSDFS20142501,CW,25/1/2014,2014,1,25,232,1459,67562-39-4,DF,1234678-HpCDF,27.4,0.274,0.274,104,1,,,,,,,
CWSDFS20142501,CW,25/1/2014,2014,1,25,232,1459,55673-89-7,DF,1234789-HpCDF,3.3,0.033,0.033,104,1,,,,,,,
CWSDFS20142501,CW,25/1/2014,2014,1,25,232,1459,35822-46-9,DF,1234678-HpCDD,59.4,0.594,0.594,104,1,,,,,,,
CWSDFS20142501,CW,25/1/2014,2014,1,25,232,1459,39001-02-0,DF,OCDF,17.8,0.0178,0.0178,104,1,,,,,,,
CWSDFS20142501,CW,25/1/2014,2014,1,25,232,1459,3268-87-9,DF,OCDD,259,0.259,0.259,104,1,,,,,,,
CWSDFS20142501,CW,25/1/2014,2014,1,25,232,1459,DIOXIN,DF,DIOXIN,10.7,0.031,0.0316,105,1,,,,,,,
TWSDFS20140701A1,TW,7/1/2014,2014,1,7,232.5,1420,51207-31-9,DF,2378-TCDF,8,0.8,0.8,104,1,,,,,,,
TWSDFS20140701A1,TW,7/1/2014,2014,1,7,232.5,1420,1746-01-6,DF,2378-TCDD,-0.5,0.25,0.25,104,1,,,,,,,
TWSDFS20140701A1,TW,7/1/2014,2014,1,7,232.5,1420,57117-41-6,DF,12378-PeCDF,11.4,0.57,0.57,104,1,,,,,,,
TWSDFS20140701A1,TW,7/1/2014,2014,1,7,232.5,1420,57117-31-4,DF,23478-PeCDF,13.1,6.55,6.55,104,1,,,,,,,
TWSDFS20140701A1,TW,7/1/2014,2014,1,7,232.5,1420,40321-76-4,DF,12378-PeCDD,-2.5,0.625,0.625,104,1,,,,,,,
TWSDFS20140701A1,TW,7/1/2014,2014,1,7,232.5,1420,70648-26-9,DF,123478-HxCDF,13.1,1.31,1.31,104,1,,,,,,,
TWSDFS20140701A1,TW,7/1/2014,2014,1,7,232.5,1420,57117-44-9,DF,123678-HxCDF,13.8,1.38,1.38,104,1,,,,,,,
TWSDFS20140701A1,TW,7/1/2014,2014,1,7,232.5,1420,60851-34-5,DF,234678-HxCDF,9.7,0.97,0.97,104,1,,,,,,,
TWSDFS20140701A1,TW,7/1/2014,2014,1,7,232.5,1420,72918-21-9,DF,123789-HxCDF,-2.5,0.125,0.125,104,1,,,,,,,
TWSDFS20140701A1,TW,7/1/2014,2014,1,7,232.5,1420,39227-28-6,DF,123478-HxCDD,-2.5,0.125,0.125,104,1,,,,,,,
TWSDFS20140701A1,TW,7/1/2014,2014,1,7,232.5,1420,57653-85-7,DF,123678-HxCDD,-2.5,0.125,0.125,104,1,,,,,,,
TWSDFS20140701A1,TW,7/1/2014,2014,1,7,232.5,1420,19408-74-3,DF,123789-HxCDD,-2.5,0.125,0.125,104,1,,,,,,,
TWSDFS20140701A1,TW,7/1/2014,2014,1,7,232.5,1420,67562-39-4,DF,1234678-HpCDF,51,0.51,0.51,104,1,,,,,,,
TWSDFS20140701A1,TW,7/1/2014,2014,1,7,232.5,1420,55673-89-7,DF,1234789-HpCDF,7.8,0.078,0.078,104,1,,,,,,,
TWSDFS20140701A1,TW,7/1/2014,2014,1,7,232.5,1420,35822-46-9,DF,1234678-HpCDD,31.7,0.317,0.317,104,1,,,,,,,
TWSDFS20140701A1,TW,7/1/2014,2014,1,7,232.5,1420,39001-02-0,DF,OCDF,60.9,0.0609,0.0609,104,1,,,,,,,
TWSDFS20140701A1,TW,7/1/2014,2014,1,7,232.5,1420,3268-87-9,DF,OCDD,133,0.133,0.133,104,1,,,,,,,
TWSDFS20140701A1,TW,7/1/2014,2014,1,7,232.5,1420,DIOXIN,DF,DIOXIN,14.1,0.043,0.0427,105,1,,,,,,,
TWSDFS20140701A2,TW,7/1/2014,2014,1,7,231.7,1453,51207-31-9,DF,2378-TCDF,10,1,1,104,0,Co-location,,,,,,
TWSDFS20140701A2,TW,7/1/2014,2014,1,7,231.7,1453,1746-01-6,DF,2378-TCDD,-0.5,0.25,0.25,104,0,Co-location,,,,,,
TWSDFS20140701A2,TW,7/1/2014,2014,1,7,231.7,1453,57117-41-6,DF,12378-PeCDF,11.6,0.58,0.58,104,0,Co-location,,,,,,
TWSDFS20140701A2,TW,7/1/2014,2014,1,7,231.7,1453,57117-31-4,DF,23478-PeCDF,11.5,5.75,5.75,104,0,Co-location,,,,,,
TWSDFS20140701A2,TW,7/1/2014,2014,1,7,231.7,1453,40321-76-4,DF,12378-PeCDD,-2.5,0.625,0.625,104,0,Co-location,,,,,,
TWSDFS20140701A2,TW,7/1/2014,2014,1,7,231.7,1453,70648-26-9,DF,123478-HxCDF,13.3,1.33,1.33,104,0,Co-location,,,,,,
TWSDFS20140701A2,TW,7/1/2014,2014,1,7,231.7,1453,57117-44-9,DF,123678-HxCDF,12.9,1.29,1.29,104,0,Co-location,,,,,,
TWSDFS20140701A2,TW,7/1/2014,2014,1,7,231.7,1453,60851-34-5,DF,234678-HxCDF,10.2,1.02,1.02,104,0,Co-location,,,,,,
TWSDFS20140701A2,TW,7/1/2014,2014,1,7,231.7,1453,72918-21-9,DF,123789-HxCDF,-2.5,0.125,0.125,104,0,Co-location,,,,,,
TWSDFS20140701A2,TW,7/1/2014,2014,1,7,231.7,1453,39227-28-6,DF,123478-HxCDD,-2.5,0.125,0.125,104,0,Co-location,,,,,,
TWSDFS20140701A2,TW,7/1/2014,2014,1,7,231.7,1453,57653-85-7,DF,123678-HxCDD,-2.5,0.125,0.125,104,0,Co-location,,,,,,
TWSDFS20140701A2,TW,7/1/2014,2014,1,7,231.7,1453,19408-74-3,DF,123789-HxCDD,2.9,0.29,0.29,104,0,Co-location,,,,,,
TWSDFS20140701A2,TW,7/1/2014,2014,1,7,231.7,1453,67562-39-4,DF,1234678-HpCDF,51.7,0.517,0.517,104,0,Co-location,,,,,,
TWSDFS20140701A2,TW,7/1/2014,2014,1,7,231.7,1453,55673-89-7,DF,1234789-HpCDF,-2.5,0.0125,0.0125,104,0,Co-location,,,,,,
TWSDFS20140701A2,TW,7/1/2014,2014,1,7,231.7,1453,35822-46-9,DF,1234678-HpCDD,32.9,0.329,0.329,104,0,Co-location,,,,,,
TWSDFS20140701A2,TW,7/1/2014,2014,1,7,231.7,1453,39001-02-0,DF,OCDF,61.4,0.0614,0.0614,104,0,Co-location,,,,,,
TWSDFS20140701A2,TW,7/1/2014,2014,1,7,231.7,1453,3268-87-9,DF,OCDD,145,0.145,0.145,104,0,Co-location,,,,,,
TWSDFS20140701A2,TW,7/1/2014,2014,1,7,231.7,1453,DIOXIN,DF,DIOXIN,13.6,0.04,0.0404,105,0,Co-location,,,,,,
CWSDFS20141202,CW,12/2/2014,2014,2,12,230.7,1433,51207-31-9,DF,2378-TCDF,10,1,1,104,1,,,,,,,
CWSDFS20141202,CW,12/2/2014,2014,2,12,230.7,1433,1746-01-6,DF,2378-TCDD,0.8,0.8,0.8,104,1,,,,,,,
CWSDFS20141202,CW,12/2/2014,2014,2,12,230.7,1433,57117-41-6,DF,12378-PeCDF,15,0.75,0.75,104,1,,,,,,,
CWSDFS20141202,CW,12/2/2014,2014,2,12,230.7,1433,57117-31-4,DF,23478-PeCDF,18.4,9.2,9.2,104,1,,,,,,,
CWSDFS20141202,CW,12/2/2014,2014,2,12,230.7,1433,40321-76-4,DF,12378-PeCDD,3.7,1.85,1.85,104,1,,,,,,,
CWSDFS20141202,CW,12/2/2014,2014,2,12,230.7,1433,70648-26-9,DF,123478-HxCDF,19.3,1.93,1.93,104,1,,,,,,,
CWSDFS20141202,CW,12/2/2014,2014,2,12,230.7,1433,57117-44-9,DF,123678-HxCDF,15.5,1.55,1.55,104,1,,,,,,,
CWSDFS20141202,CW,12/2/2014,2014,2,12,230.7,1433,60851-34-5,DF,234678-HxCDF,15.2,1.52,1.52,104,1,,,,,,,
CWSDFS20141202,CW,12/2/2014,2014,2,12,230.7,1433,72918-21-9,DF,123789-HxCDF,-2.5,0.125,0.125,104,1,,,,,,,
CWSDFS20141202,CW,12/2/2014,2014,2,12,230.7,1433,39227-28-6,DF,123478-HxCDD,3.6,0.36,0.36,104,1,,,,,,,
CWSDFS20141202,CW,12/2/2014,2014,2,12,230.7,1433,57653-85-7,DF,123678-HxCDD,9.1,0.91,0.91,104,1,,,,,,,
CWSDFS20141202,CW,12/2/2014,2014,2,12,230.7,1433,19408-74-3,DF,123789-HxCDD,5.9,0.59,0.59,104,1,,,,,,,
CWSDFS20141202,CW,12/2/2014,2014,2,12,230.7,1433,67562-39-4,DF,1234678-HpCDF,50,0.5,0.5,104,1,,,,,,,
CWSDFS20141202,CW,12/2/2014,2014,2,12,230.7,1433,55673-89-7,DF,1234789-HpCDF,7.8,0.078,0.078,104,1,,,,,,,
CWSDFS20141202,CW,12/2/2014,2014,2,12,230.7,1433,35822-46-9,DF,1234678-HpCDD,49.8,0.498,0.498,104,1,,,,,,,
CWSDFS20141202,CW,12/2/2014,2014,2,12,230.7,1433,39001-02-0,DF,OCDF,53,0.053,0.053,104,1,,,,,,,
CWSDFS20141202,CW,12/2/2014,2014,2,12,230.7,1433,3268-87-9,DF,OCDD,166,0.166,0.166,104,1,,,,,,,
CWSDFS20141202,CW,12/2/2014,2014,2,12,230.7,1433,DIOXIN,DF,DIOXIN,21.9,0.066,0.0662,105,1,,,,,,,
TWSDFS20141802,TW,18/2/2014,2014,2,18,232.5,1437,51207-31-9,DF,2378-TCDF,28.8,2.88,2.88,104,1,,,,,,,
TWSDFS20141802,TW,18/2/2014,2014,2,18,232.5,1437,1746-01-6,DF,2378-TCDD,6.5,6.5,6.5,104,1,,,,,,,
TWSDFS20141802,TW,18/2/2014,2014,2,18,232.5,1437,57117-41-6,DF,12378-PeCDF,51.7,2.585,2.585,104,1,,,,,,,
TWSDFS20141802,TW,18/2/2014,2014,2,18,232.5,1437,57117-31-4,DF,23478-PeCDF,79.2,39.6,39.6,104,1,,,,,,,
TWSDFS20141802,TW,18/2/2014,2014,2,18,232.5,1437,40321-76-4,DF,12378-PeCDD,15.5,7.75,7.75,104,1,,,,,,,
TWSDFS20141802,TW,18/2/2014,2014,2,18,232.5,1437,70648-26-9,DF,123478-HxCDF,73.6,7.36,7.36,104,1,,,,,,,
TWSDFS20141802,TW,18/2/2014,2014,2,18,232.5,1437,57117-44-9,DF,123678-HxCDF,68.8,6.88,6.88,104,1,,,,,,,
TWSDFS20141802,TW,18/2/2014,2014,2,18,232.5,1437,60851-34-5,DF,234678-HxCDF,75.3,7.53,7.53,104,1,,,,,,,
TWSDFS20141802,TW,18/2/2014,2014,2,18,232.5,1437,72918-21-9,DF,123789-HxCDF,8.2,0.82,0.82,104,1,,,,,,,
TWSDFS20141802,TW,18/2/2014,2014,2,18,232.5,1437,39227-28-6,DF,123478-HxCDD,14.8,1.48,1.48,104,1,,,,,,,
TWSDFS20141802,TW,18/2/2014,2014,2,18,232.5,1437,57653-85-7,DF,123678-HxCDD,37.3,3.73,3.73,104,1,,,,,,,
TWSDFS20141802,TW,18/2/2014,2014,2,18,232.5,1437,19408-74-3,DF,123789-HxCDD,25,2.5,2.5,104,1,,,,,,,
TWSDFS20141802,TW,18/2/2014,2014,2,18,232.5,1437,67562-39-4,DF,1234678-HpCDF,236,2.36,2.36,104,1,,,,,,,
TWSDFS20141802,TW,18/2/2014,2014,2,18,232.5,1437,55673-89-7,DF,1234789-HpCDF,34.5,0.345,0.345,104,1,,,,,,,
TWSDFS20141802,TW,18/2/2014,2014,2,18,232.5,1437,35822-46-9,DF,1234678-HpCDD,179,1.79,1.79,104,1,,,,,,,
TWSDFS20141802,TW,18/2/2014,2014,2,18,232.5,1437,39001-02-0,DF,OCDF,154,0.154,0.154,104,1,,,,,,,
TWSDFS20141802,TW,18/2/2014,2014,2,18,232.5,1437,3268-87-9,DF,OCDD,483,0.483,0.483,104,1,,,,,,,
TWSDFS20141802,TW,18/2/2014,2014,2,18,232.5,1437,DIOXIN,DF,DIOXIN,94.7,0.284,0.2834,105,1,,,,,,,
CWSDFS20141203A1,CW,12/3/2014,2014,3,12,233.4,1417,51207-31-9,DF,2378-TCDF,10.7,1.07,1.07,104,1,,,,,,,
CWSDFS20141203A1,CW,12/3/2014,2014,3,12,233.4,1417,1746-01-6,DF,2378-TCDD,-0.5,0.25,0.25,104,1,,,,,,,
CWSDFS20141203A1,CW,12/3/2014,2014,3,12,233.4,1417,57117-41-6,DF,12378-PeCDF,14.4,0.72,0.72,104,1,,,,,,,
CWSDFS20141203A1,CW,12/3/2014,2014,3,12,233.4,1417,57117-31-4,DF,23478-PeCDF,18.9,9.45,9.45,104,1,,,,,,,
CWSDFS20141203A1,CW,12/3/2014,2014,3,12,233.4,1417,40321-76-4,DF,12378-PeCDD,-2.5,0.625,0.625,104,1,,,,,,,
CWSDFS20141203A1,CW,12/3/2014,2014,3,12,233.4,1417,70648-26-9,DF,123478-HxCDF,15.8,1.58,1.58,104,1,,,,,,,
CWSDFS20141203A1,CW,12/3/2014,2014,3,12,233.4,1417,57117-44-9,DF,123678-HxCDF,16.8,1.68,1.68,104,1,,,,,,,
CWSDFS20141203A1,CW,12/3/2014,2014,3,12,233.4,1417,60851-34-5,DF,234678-HxCDF,13.3,1.33,1.33,104,1,,,,,,,
CWSDFS20141203A1,CW,12/3/2014,2014,3,12,233.4,1417,72918-21-9,DF,123789-HxCDF,-2.5,0.125,0.125,104,1,,,,,,,
CWSDFS20141203A1,CW,12/3/2014,2014,3,12,233.4,1417,39227-28-6,DF,123478-HxCDD,-2.5,0.125,0.125,104,1,,,,,,,
CWSDFS20141203A1,CW,12/3/2014,2014,3,12,233.4,1417,57653-85-7,DF,123678-HxCDD,6.9,0.69,0.69,104,1,,,,,,,
CWSDFS20141203A1,CW,12/3/2014,2014,3,12,233.4,1417,19408-74-3,DF,123789-HxCDD,5,0.5,0.5,104,1,,,,,,,
CWSDFS20141203A1,CW,12/3/2014,2014,3,12,233.4,1417,67562-39-4,DF,1234678-HpCDF,50.8,0.508,0.508,104,1,,,,,,,
CWSDFS20141203A1,CW,12/3/2014,2014,3,12,233.4,1417,55673-89-7,DF,1234789-HpCDF,8.2,0.082,0.082,104,1,,,,,,,
CWSDFS20141203A1,CW,12/3/2014,2014,3,12,233.4,1417,35822-46-9,DF,1234678-HpCDD,57.6,0.576,0.576,104,1,,,,,,,
CWSDFS20141203A1,CW,12/3/2014,2014,3,12,233.4,1417,39001-02-0,DF,OCDF,48.3,0.0483,0.0483,104,1,,,,,,,
CWSDFS20141203A1,CW,12/3/2014,2014,3,12,233.4,1417,3268-87-9,DF,OCDD,189,0.189,0.189,104,1,,,,,,,
CWSDFS20141203A1,CW,12/3/2014,2014,3,12,233.4,1417,DIOXIN,DF,DIOXIN,19.5,0.059,0.059,105,1,,,,,,,
CWSDFS20141203A2,CW,12/3/2014,2014,3,12,232.2,1389,51207-31-9,DF,2378-TCDF,10.9,1.09,1.09,104,0,Co-location,,,,,,
CWSDFS20141203A2,CW,12/3/2014,2014,3,12,232.2,1389,1746-01-6,DF,2378-TCDD,-0.5,0.25,0.25,104,0,Co-location,,,,,,
CWSDFS20141203A2,CW,12/3/2014,2014,3,12,232.2,1389,57117-41-6,DF,12378-PeCDF,13.2,0.66,0.66,104,0,Co-location,,,,,,
CWSDFS20141203A2,CW,12/3/2014,2014,3,12,232.2,1389,57117-31-4,DF,23478-PeCDF,19.6,9.8,9.8,104,0,Co-location,,,,,,
CWSDFS20141203A2,CW,12/3/2014,2014,3,12,232.2,1389,40321-76-4,DF,12378-PeCDD,-2.5,0.625,0.625,104,0,Co-location,,,,,,
CWSDFS20141203A2,CW,12/3/2014,2014,3,12,232.2,1389,70648-26-9,DF,123478-HxCDF,16.1,1.61,1.61,104,0,Co-location,,,,,,
CWSDFS20141203A2,CW,12/3/2014,2014,3,12,232.2,1389,57117-44-9,DF,123678-HxCDF,16.4,1.64,1.64,104,0,Co-location,,,,,,
CWSDFS20141203A2,CW,12/3/2014,2014,3,12,232.2,1389,60851-34-5,DF,234678-HxCDF,14.4,1.44,1.44,104,0,Co-location,,,,,,
CWSDFS20141203A2,CW,12/3/2014,2014,3,12,232.2,1389,72918-21-9,DF,123789-HxCDF,-2.5,0.125,0.125,104,0,Co-location,,,,,,
CWSDFS20141203A2,CW,12/3/2014,2014,3,12,232.2,1389,39227-28-6,DF,123478-HxCDD,-2.5,0.125,0.125,104,0,Co-location,,,,,,
CWSDFS20141203A2,CW,12/3/2014,2014,3,12,232.2,1389,57653-85-7,DF,123678-HxCDD,6.1,0.61,0.61,104,0,Co-location,,,,,,
CWSDFS20141203A2,CW,12/3/2014,2014,3,12,232.2,1389,19408-74-3,DF,123789-HxCDD,4.3,0.43,0.43,104,0,Co-location,,,,,,
CWSDFS20141203A2,CW,12/3/2014,2014,3,12,232.2,1389,67562-39-4,DF,1234678-HpCDF,51.7,0.517,0.517,104,0,Co-location,,,,,,
CWSDFS20141203A2,CW,12/3/2014,2014,3,12,232.2,1389,55673-89-7,DF,1234789-HpCDF,7.9,0.079,0.079,104,0,Co-location,,,,,,
CWSDFS20141203A2,CW,12/3/2014,2014,3,12,232.2,1389,35822-46-9,DF,1234678-HpCDD,54.8,0.548,0.548,104,0,Co-location,,,,,,
CWSDFS20141203A2,CW,12/3/2014,2014,3,12,232.2,1389,39001-02-0,DF,OCDF,46.2,0.0462,0.0462,104,0,Co-location,,,,,,
CWSDFS20141203A2,CW,12/3/2014,2014,3,12,232.2,1389,3268-87-9,DF,OCDD,187,0.187,0.187,104,0,Co-location,,,,,,
CWSDFS20141203A2,CW,12/3/2014,2014,3,12,232.2,1389,DIOXIN,DF,DIOXIN,19.8,0.061,0.0614,105,0,Co-location,,,,,,
TWSDFS20142403,TW,24/3/2014,2014,3,24,231.1,1402,51207-31-9,DF,2378-TCDF,6.5,0.65,0.65,104,1,,,,,,,
TWSDFS20142403,TW,24/3/2014,2014,3,24,231.1,1402,1746-01-6,DF,2378-TCDD,-0.5,0.25,0.25,104,1,,,,,,,
TWSDFS20142403,TW,24/3/2014,2014,3,24,231.1,1402,57117-41-6,DF,12378-PeCDF,6.9,0.345,0.345,104,1,,,,,,,
TWSDFS20142403,TW,24/3/2014,2014,3,24,231.1,1402,57117-31-4,DF,23478-PeCDF,8,4,4,104,1,,,,,,,
TWSDFS20142403,TW,24/3/2014,2014,3,24,231.1,1402,40321-76-4,DF,12378-PeCDD,-2.5,0.625,0.625,104,1,,,,,,,
TWSDFS20142403,TW,24/3/2014,2014,3,24,231.1,1402,70648-26-9,DF,123478-HxCDF,7.3,0.73,0.73,104,1,,,,,,,
TWSDFS20142403,TW,24/3/2014,2014,3,24,231.1,1402,57117-44-9,DF,123678-HxCDF,7.8,0.78,0.78,104,1,,,,,,,
TWSDFS20142403,TW,24/3/2014,2014,3,24,231.1,1402,60851-34-5,DF,234678-HxCDF,8.8,0.88,0.88,104,1,,,,,,,
TWSDFS20142403,TW,24/3/2014,2014,3,24,231.1,1402,72918-21-9,DF,123789-HxCDF,-2.5,0.125,0.125,104,1,,,,,,,
TWSDFS20142403,TW,24/3/2014,2014,3,24,231.1,1402,39227-28-6,DF,123478-HxCDD,-2.5,0.125,0.125,104,1,,,,,,,
TWSDFS20142403,TW,24/3/2014,2014,3,24,231.1,1402,57653-85-7,DF,123678-HxCDD,3.1,0.31,0.31,104,1,,,,,,,
TWSDFS20142403,TW,24/3/2014,2014,3,24,231.1,1402,19408-74-3,DF,123789-HxCDD,2.9,0.29,0.29,104,1,,,,,,,
TWSDFS20142403,TW,24/3/2014,2014,3,24,231.1,1402,67562-39-4,DF,1234678-HpCDF,27.9,0.279,0.279,104,1,,,,,,,
TWSDFS20142403,TW,24/3/2014,2014,3,24,231.1,1402,55673-89-7,DF,1234789-HpCDF,4.3,0.043,0.043,104,1,,,,,,,
TWSDFS20142403,TW,24/3/2014,2014,3,24,231.1,1402,35822-46-9,DF,1234678-HpCDD,28.6,0.286,0.286,104,1,,,,,,,
TWSDFS20142403,TW,24/3/2014,2014,3,24,231.1,1402,39001-02-0,DF,OCDF,26.2,0.0262,0.0262,104,1,,,,,,,
TWSDFS20142403,TW,24/3/2014,2014,3,24,231.1,1402,3268-87-9,DF,OCDD,126,0.126,0.126,104,1,,,,,,,
TWSDFS20142403,TW,24/3/2014,2014,3,24,231.1,1402,DIOXIN,DF,DIOXIN,9.9,0.03,0.0306,105,1,,,,,,,
CWSDFS20142504,CW,25/4/2014,2014,4,25,231.3,1445,51207-31-9,DF,2378-TCDF,7.3,0.73,0.73,104,1,,,,,,,
CWSDFS20142504,CW,25/4/2014,2014,4,25,231.3,1445,1746-01-6,DF,2378-TCDD,-0.5,0.25,0.25,104,1,,,,,,,
CWSDFS20142504,CW,25/4/2014,2014,4,25,231.3,1445,57117-41-6,DF,12378-PeCDF,6.6,0.33,0.33,104,1,,,,,,,
CWSDFS20142504,CW,25/4/2014,2014,4,25,231.3,1445,57117-31-4,DF,23478-PeCDF,8.8,4.4,4.4,104,1,,,,,,,
CWSDFS20142504,CW,25/4/2014,2014,4,25,231.3,1445,40321-76-4,DF,12378-PeCDD,-2.5,0.625,0.625,104,1,,,,,,,
CWSDFS20142504,CW,25/4/2014,2014,4,25,231.3,1445,70648-26-9,DF,123478-HxCDF,8.5,0.85,0.85,104,1,,,,,,,
CWSDFS20142504,CW,25/4/2014,2014,4,25,231.3,1445,57117-44-9,DF,123678-HxCDF,8,0.8,0.8,104,1,,,,,,,
CWSDFS20142504,CW,25/4/2014,2014,4,25,231.3,1445,60851-34-5,DF,234678-HxCDF,5.4,0.54,0.54,104,1,,,,,,,
CWSDFS20142504,CW,25/4/2014,2014,4,25,231.3,1445,72918-21-9,DF,123789-HxCDF,-2.5,0.125,0.125,104,1,,,,,,,
CWSDFS20142504,CW,25/4/2014,2014,4,25,231.3,1445,39227-28-6,DF,123478-HxCDD,-2.5,0.125,0.125,104,1,,,,,,,
CWSDFS20142504,CW,25/4/2014,2014,4,25,231.3,1445,57653-85-7,DF,123678-HxCDD,3.8,0.38,0.38,104,1,,,,,,,
CWSDFS20142504,CW,25/4/2014,2014,4,25,231.3,1445,19408-74-3,DF,123789-HxCDD,-2.5,0.125,0.125,104,1,,,,,,,
CWSDFS20142504,CW,25/4/2014,2014,4,25,231.3,1445,67562-39-4,DF,1234678-HpCDF,25.9,0.259,0.259,104,1,,,,,,,
CWSDFS20142504,CW,25/4/2014,2014,4,25,231.3,1445,55673-89-7,DF,1234789-HpCDF,3.5,0.035,0.035,104,1,,,,,,,
CWSDFS20142504,CW,25/4/2014,2014,4,25,231.3,1445,35822-46-9,DF,1234678-HpCDD,41.8,0.418,0.418,104,1,,,,,,,
CWSDFS20142504,CW,25/4/2014,2014,4,25,231.3,1445,39001-02-0,DF,OCDF,17.3,0.0173,0.0173,104,1,,,,,,,
CWSDFS20142504,CW,25/4/2014,2014,4,25,231.3,1445,3268-87-9,DF,OCDD,163,0.163,0.163,104,1,,,,,,,
CWSDFS20142504,CW,25/4/2014,2014,4,25,231.3,1445,DIOXIN,DF,DIOXIN,10.2,0.03,0.0305,105,1,,,,,,,
TWSDFS20140704A1,TW,7/4/2014,2014,4,7,231.8,1413,51207-31-9,DF,2378-TCDF,8,0.8,0.8,104,1,,,,,,,
TWSDFS20140704A1,TW,7/4/2014,2014,4,7,231.8,1413,1746-01-6,DF,2378-TCDD,-0.5,0.25,0.25,104,1,,,,,,,
TWSDFS20140704A1,TW,7/4/2014,2014,4,7,231.8,1413,57117-41-6,DF,12378-PeCDF,7.3,0.365,0.365,104,1,,,,,,,
TWSDFS20140704A1,TW,7/4/2014,2014,4,7,231.8,1413,57117-31-4,DF,23478-PeCDF,10,5,5,104,1,,,,,,,
TWSDFS20140704A1,TW,7/4/2014,2014,4,7,231.8,1413,40321-76-4,DF,12378-PeCDD,-2.5,0.625,0.625,104,1,,,,,,,
TWSDFS20140704A1,TW,7/4/2014,2014,4,7,231.8,1413,70648-26-9,DF,123478-HxCDF,10.2,1.02,1.02,104,1,,,,,,,
TWSDFS20140704A1,TW,7/4/2014,2014,4,7,231.8,1413,57117-44-9,DF,123678-HxCDF,8.6,0.86,0.86,104,1,,,,,,,
TWSDFS20140704A1,TW,7/4/2014,2014,4,7,231.8,1413,60851-34-5,DF,234678-HxCDF,8.8,0.88,0.88,104,1,,,,,,,
TWSDFS20140704A1,TW,7/4/2014,2014,4,7,231.8,1413,72918-21-9,DF,123789-HxCDF,-2.5,0.125,0.125,104,1,,,,,,,
TWSDFS20140704A1,TW,7/4/2014,2014,4,7,231.8,1413,39227-28-6,DF,123478-HxCDD,-2.5,0.125,0.125,104,1,,,,,,,
TWSDFS20140704A1,TW,7/4/2014,2014,4,7,231.8,1413,57653-85-7,DF,123678-HxCDD,7,0.7,0.7,104,1,,,,,,,
TWSDFS20140704A1,TW,7/4/2014,2014,4,7,231.8,1413,19408-74-3,DF,123789-HxCDD,3.8,0.38,0.38,104,1,,,,,,,
TWSDFS20140704A1,TW,7/4/2014,2014,4,7,231.8,1413,67562-39-4,DF,1234678-HpCDF,37.1,0.371,0.371,104,1,,,,,,,
TWSDFS20140704A1,TW,7/4/2014,2014,4,7,231.8,1413,55673-89-7,DF,1234789-HpCDF,4.3,0.043,0.043,104,1,,,,,,,
TWSDFS20140704A1,TW,7/4/2014,2014,4,7,231.8,1413,35822-46-9,DF,1234678-HpCDD,37.4,0.374,0.374,104,1,,,,,,,
TWSDFS20140704A1,TW,7/4/2014,2014,4,7,231.8,1413,39001-02-0,DF,OCDF,25,0.025,0.025,104,1,,,,,,,
TWSDFS20140704A1,TW,7/4/2014,2014,4,7,231.8,1413,3268-87-9,DF,OCDD,98.6,0.0986,0.0986,104,1,,,,,,,
TWSDFS20140704A1,TW,7/4/2014,2014,4,7,231.8,1413,DIOXIN,DF,DIOXIN,12,0.037,0.0366,105,1,,,,,,,
TWSDFS20140704A2,TW,7/4/2014,2014,4,7,230.5,1432,51207-31-9,DF,2378-TCDF,7.1,0.71,0.71,104,0,Co-location,,,,,,
TWSDFS20140704A2,TW,7/4/2014,2014,4,7,230.5,1432,1746-01-6,DF,2378-TCDD,-0.5,0.25,0.25,104,0,Co-location,,,,,,
TWSDFS20140704A2,TW,7/4/2014,2014,4,7,230.5,1432,57117-41-6,DF,12378-PeCDF,7.5,0.375,0.375,104,0,Co-location,,,,,,
TWSDFS20140704A2,TW,7/4/2014,2014,4,7,230.5,1432,57117-31-4,DF,23478-PeCDF,8.9,4.45,4.45,104,0,Co-location,,,,,,
TWSDFS20140704A2,TW,7/4/2014,2014,4,7,230.5,1432,40321-76-4,DF,12378-PeCDD,-2.5,0.625,0.625,104,0,Co-location,,,,,,
TWSDFS20140704A2,TW,7/4/2014,2014,4,7,230.5,1432,70648-26-9,DF,123478-HxCDF,11.6,1.16,1.16,104,0,Co-location,,,,,,
TWSDFS20140704A2,TW,7/4/2014,2014,4,7,230.5,1432,57117-44-9,DF,123678-HxCDF,9.6,0.96,0.96,104,0,Co-location,,,,,,
TWSDFS20140704A2,TW,7/4/2014,2014,4,7,230.5,1432,60851-34-5,DF,234678-HxCDF,9.2,0.92,0.92,104,0,Co-location,,,,,,
TWSDFS20140704A2,TW,7/4/2014,2014,4,7,230.5,1432,72918-21-9,DF,123789-HxCDF,-2.5,0.125,0.125,104,0,Co-location,,,,,,
TWSDFS20140704A2,TW,7/4/2014,2014,4,7,230.5,1432,39227-28-6,DF,123478-HxCDD,-2.5,0.125,0.125,104,0,Co-location,,,,,,
TWSDFS20140704A2,TW,7/4/2014,2014,4,7,230.5,1432,57653-85-7,DF,123678-HxCDD,5.9,0.59,0.59,104,0,Co-location,,,,,,
TWSDFS20140704A2,TW,7/4/2014,2014,4,7,230.5,1432,19408-74-3,DF,123789-HxCDD,4.6,0.46,0.46,104,0,Co-location,,,,,,
TWSDFS20140704A2,TW,7/4/2014,2014,4,7,230.5,1432,67562-39-4,DF,1234678-HpCDF,40.2,0.402,0.402,104,0,Co-location,,,,,,
TWSDFS20140704A2,TW,7/4/2014,2014,4,7,230.5,1432,55673-89-7,DF,1234789-HpCDF,5.7,0.057,0.057,104,0,Co-location,,,,,,
TWSDFS20140704A2,TW,7/4/2014,2014,4,7,230.5,1432,35822-46-9,DF,1234678-HpCDD,40.9,0.409,0.409,104,0,Co-location,,,,,,
TWSDFS20140704A2,TW,7/4/2014,2014,4,7,230.5,1432,39001-02-0,DF,OCDF,28.7,0.0287,0.0287,104,0,Co-location,,,,,,
TWSDFS20140704A2,TW,7/4/2014,2014,4,7,230.5,1432,3268-87-9,DF,OCDD,116,0.116,0.116,104,0,Co-location,,,,,,
TWSDFS20140704A2,TW,7/4/2014,2014,4,7,230.5,1432,DIOXIN,DF,DIOXIN,11.8,0.036,0.0357,105,0,Co-location,,,,,,
CWSDFS20140705,CW,7/5/2014,2014,5,7,231.3,1436,51207-31-9,DF,2378-TCDF,6.4,0.64,0.64,104,1,,,,,,,
CWSDFS20140705,CW,7/5/2014,2014,5,7,231.3,1436,1746-01-6,DF,2378-TCDD,-0.5,0.25,0.25,104,1,,,,,,,
CWSDFS20140705,CW,7/5/2014,2014,5,7,231.3,1436,57117-41-6,DF,12378-PeCDF,5,0.25,0.25,104,1,,,,,,,
CWSDFS20140705,CW,7/5/2014,2014,5,7,231.3,1436,57117-31-4,DF,23478-PeCDF,5.9,2.95,2.95,104,1,,,,,,,
CWSDFS20140705,CW,7/5/2014,2014,5,7,231.3,1436,40321-76-4,DF,12378-PeCDD,-2.5,0.625,0.625,104,1,,,,,,,
CWSDFS20140705,CW,7/5/2014,2014,5,7,231.3,1436,70648-26-9,DF,123478-HxCDF,6.5,0.65,0.65,104,1,,,,,,,
CWSDFS20140705,CW,7/5/2014,2014,5,7,231.3,1436,57117-44-9,DF,123678-HxCDF,5.3,0.53,0.53,104,1,,,,,,,
CWSDFS20140705,CW,7/5/2014,2014,5,7,231.3,1436,60851-34-5,DF,234678-HxCDF,5.6,0.56,0.56,104,1,,,,,,,
CWSDFS20140705,CW,7/5/2014,2014,5,7,231.3,1436,72918-21-9,DF,123789-HxCDF,-2.5,0.125,0.125,104,1,,,,,,,
CWSDFS20140705,CW,7/5/2014,2014,5,7,231.3,1436,39227-28-6,DF,123478-HxCDD,-2.5,0.125,0.125,104,1,,,,,,,
CWSDFS20140705,CW,7/5/2014,2014,5,7,231.3,1436,57653-85-7,DF,123678-HxCDD,4.3,0.43,0.43,104,1,,,,,,,
CWSDFS20140705,CW,7/5/2014,2014,5,7,231.3,1436,19408-74-3,DF,123789-HxCDD,-2.5,0.125,0.125,104,1,,,,,,,
CWSDFS20140705,CW,7/5/2014,2014,5,7,231.3,1436,67562-39-4,DF,1234678-HpCDF,22.4,0.224,0.224,104,1,,,,,,,
CWSDFS20140705,CW,7/5/2014,2014,5,7,231.3,1436,55673-89-7,DF,1234789-HpCDF,2.6,0.026,0.026,104,1,,,,,,,
CWSDFS20140705,CW,7/5/2014,2014,5,7,231.3,1436,35822-46-9,DF,1234678-HpCDD,46.1,0.461,0.461,104,1,,,,,,,
CWSDFS20140705,CW,7/5/2014,2014,5,7,231.3,1436,39001-02-0,DF,OCDF,13.6,0.0136,0.0136,104,1,,,,,,,
CWSDFS20140705,CW,7/5/2014,2014,5,7,231.3,1436,3268-87-9,DF,OCDD,158,0.158,0.158,104,1,,,,,,,
CWSDFS20140705,CW,7/5/2014,2014,5,7,231.3,1436,DIOXIN,DF,DIOXIN,8.1,0.025,0.0244,105,1,,,,,,,
TWSDFS20141905,TW,19/5/2014,2014,5,19,231.8,1427,51207-31-9,DF,2378-TCDF,3.1,0.31,0.31,104,1,,,,,,,
TWSDFS20141905,TW,19/5/2014,2014,5,19,231.8,1427,1746-01-6,DF,2378-TCDD,-0.5,0.25,0.25,104,1,,,,,,,
TWSDFS20141905,TW,19/5/2014,2014,5,19,231.8,1427,57117-41-6,DF,12378-PeCDF,-2.5,0.0625,0.0625,104,1,,,,,,,
TWSDFS20141905,TW,19/5/2014,2014,5,19,231.8,1427,57117-31-4,DF,23478-PeCDF,-2.5,0.625,0.625,104,1,,,,,,,
TWSDFS20141905,TW,19/5/2014,2014,5,19,231.8,1427,40321-76-4,DF,12378-PeCDD,-2.5,0.625,0.625,104,1,,,,,,,
TWSDFS20141905,TW,19/5/2014,2014,5,19,231.8,1427,70648-26-9,DF,123478-HxCDF,-2.5,0.125,0.125,104,1,,,,,,,
TWSDFS20141905,TW,19/5/2014,2014,5,19,231.8,1427,57117-44-9,DF,123678-HxCDF,-2.5,0.125,0.125,104,1,,,,,,,
TWSDFS20141905,TW,19/5/2014,2014,5,19,231.8,1427,60851-34-5,DF,234678-HxCDF,-2.5,0.125,0.125,104,1,,,,,,,
TWSDFS20141905,TW,19/5/2014,2014,5,19,231.8,1427,72918-21-9,DF,123789-HxCDF,-2.5,0.125,0.125,104,1,,,,,,,
TWSDFS20141905,TW,19/5/2014,2014,5,19,231.8,1427,39227-28-6,DF,123478-HxCDD,-2.5,0.125,0.125,104,1,,,,,,,
TWSDFS20141905,TW,19/5/2014,2014,5,19,231.8,1427,57653-85-7,DF,123678-HxCDD,-2.5,0.125,0.125,104,1,,,,,,,
TWSDFS20141905,TW,19/5/2014,2014,5,19,231.8,1427,19408-74-3,DF,123789-HxCDD,-2.5,0.125,0.125,104,1,,,,,,,
TWSDFS20141905,TW,19/5/2014,2014,5,19,231.8,1427,67562-39-4,DF,1234678-HpCDF,4,0.04,0.04,104,1,,,,,,,
TWSDFS20141905,TW,19/5/2014,2014,5,19,231.8,1427,55673-89-7,DF,1234789-HpCDF,-2.5,0.0125,0.0125,104,1,,,,,,,
TWSDFS20141905,TW,19/5/2014,2014,5,19,231.8,1427,35822-46-9,DF,1234678-HpCDD,8.1,0.081,0.081,104,1,,,,,,,
TWSDFS20141905,TW,19/5/2014,2014,5,19,231.8,1427,39001-02-0,DF,OCDF,-5,0.0025,0.0025,104,1,,,,,,,
TWSDFS20141905,TW,19/5/2014,2014,5,19,231.8,1427,3268-87-9,DF,OCDD,25.7,0.0257,0.0257,104,1,,,,,,,
TWSDFS20141905,TW,19/5/2014,2014,5,19,231.8,1427,DIOXIN,DF,DIOXIN,2.9,0.009,0.0088,105,1,,,,,,,
CWSDFS20141206A1,CW,12/6/2014,2014,6,12,227.4,1423,51207-31-9,DF,2378-TCDF,-0.5,0.025,0.025,104,1,,,,,,,
CWSDFS20141206A1,CW,12/6/2014,2014,6,12,227.4,1423,1746-01-6,DF,2378-TCDD,-0.5,0.25,0.25,104,1,,,,,,,
CWSDFS20141206A1,CW,12/6/2014,2014,6,12,227.4,1423,57117-41-6,DF,12378-PeCDF,6.4,0.32,0.32,104,1,,,,,,,
CWSDFS20141206A1,CW,12/6/2014,2014,6,12,227.4,1423,57117-31-4,DF,23478-PeCDF,5.6,2.8,2.8,104,1,,,,,,,
CWSDFS20141206A1,CW,12/6/2014,2014,6,12,227.4,1423,40321-76-4,DF,12378-PeCDD,-2.5,0.625,0.625,104,1,,,,,,,
CWSDFS20141206A1,CW,12/6/2014,2014,6,12,227.4,1423,70648-26-9,DF,123478-HxCDF,7.8,0.78,0.78,104,1,,,,,,,
CWSDFS20141206A1,CW,12/6/2014,2014,6,12,227.4,1423,57117-44-9,DF,123678-HxCDF,7.6,0.76,0.76,104,1,,,,,,,
CWSDFS20141206A1,CW,12/6/2014,2014,6,12,227.4,1423,60851-34-5,DF,234678-HxCDF,8,0.8,0.8,104,1,,,,,,,
CWSDFS20141206A1,CW,12/6/2014,2014,6,12,227.4,1423,72918-21-9,DF,123789-HxCDF,-2.5,0.125,0.125,104,1,,,,,,,
CWSDFS20141206A1,CW,12/6/2014,2014,6,12,227.4,1423,39227-28-6,DF,123478-HxCDD,-2.5,0.125,0.125,104,1,,,,,,,
CWSDFS20141206A1,CW,12/6/2014,2014,6,12,227.4,1423,57653-85-7,DF,123678-HxCDD,3.2,0.32,0.32,104,1,,,,,,,
CWSDFS20141206A1,CW,12/6/2014,2014,6,12,227.4,1423,19408-74-3,DF,123789-HxCDD,-2.5,0.125,0.125,104,1,,,,,,,
CWSDFS20141206A1,CW,12/6/2014,2014,6,12,227.4,1423,67562-39-4,DF,1234678-HpCDF,28.3,0.283,0.283,104,1,,,,,,,
CWSDFS20141206A1,CW,12/6/2014,2014,6,12,227.4,1423,55673-89-7,DF,1234789-HpCDF,3.7,0.037,0.037,104,1,,,,,,,
CWSDFS20141206A1,CW,12/6/2014,2014,6,12,227.4,1423,35822-46-9,DF,1234678-HpCDD,31.3,0.313,0.313,104,1,,,,,,,
CWSDFS20141206A1,CW,12/6/2014,2014,6,12,227.4,1423,39001-02-0,DF,OCDF,19.7,0.0197,0.0197,104,1,,,,,,,
CWSDFS20141206A1,CW,12/6/2014,2014,6,12,227.4,1423,3268-87-9,DF,OCDD,161,0.161,0.161,104,1,,,,,,,
CWSDFS20141206A1,CW,12/6/2014,2014,6,12,227.4,1423,DIOXIN,DF,DIOXIN,7.9,0.024,0.0244,105,1,,,,,,,
CWSDFS20141206A2,CW,12/6/2014,2014,6,12,232.6,1396,51207-31-9,DF,2378-TCDF,-0.5,0.025,0.025,104,0,Co-location,,,,,,
CWSDFS20141206A2,CW,12/6/2014,2014,6,12,232.6,1396,1746-01-6,DF,2378-TCDD,-0.5,0.25,0.25,104,0,Co-location,,,,,,
CWSDFS20141206A2,CW,12/6/2014,2014,6,12,232.6,1396,57117-41-6,DF,12378-PeCDF,6,0.3,0.3,104,0,Co-location,,,,,,
CWSDFS20141206A2,CW,12/6/2014,2014,6,12,232.6,1396,57117-31-4,DF,23478-PeCDF,5,2.5,2.5,104,0,Co-location,,,,,,
CWSDFS20141206A2,CW,12/6/2014,2014,6,12,232.6,1396,40321-76-4,DF,12378-PeCDD,-2.5,0.625,0.625,104,0,Co-location,,,,,,
CWSDFS20141206A2,CW,12/6/2014,2014,6,12,232.6,1396,70648-26-9,DF,123478-HxCDF,8.8,0.88,0.88,104,0,Co-location,,,,,,
CWSDFS20141206A2,CW,12/6/2014,2014,6,12,232.6,1396,57117-44-9,DF,123678-HxCDF,6.8,0.68,0.68,104,0,Co-location,,,,,,
CWSDFS20141206A2,CW,12/6/2014,2014,6,12,232.6,1396,60851-34-5,DF,234678-HxCDF,8.6,0.86,0.86,104,0,Co-location,,,,,,
CWSDFS20141206A2,CW,12/6/2014,2014,6,12,232.6,1396,72918-21-9,DF,123789-HxCDF,2.7,0.27,0.27,104,0,Co-location,,,,,,
CWSDFS20141206A2,CW,12/6/2014,2014,6,12,232.6,1396,39227-28-6,DF,123478-HxCDD,-2.5,0.125,0.125,104,0,Co-location,,,,,,
CWSDFS20141206A2,CW,12/6/2014,2014,6,12,232.6,1396,57653-85-7,DF,123678-HxCDD,-2.5,0.125,0.125,104,0,Co-location,,,,,,
CWSDFS20141206A2,CW,12/6/2014,2014,6,12,232.6,1396,19408-74-3,DF,123789-HxCDD,-2.5,0.125,0.125,104,0,Co-location,,,,,,
CWSDFS20141206A2,CW,12/6/2014,2014,6,12,232.6,1396,67562-39-4,DF,1234678-HpCDF,27.9,0.279,0.279,104,0,Co-location,,,,,,
CWSDFS20141206A2,CW,12/6/2014,2014,6,12,232.6,1396,55673-89-7,DF,1234789-HpCDF,-2.5,0.0125,0.0125,104,0,Co-location,,,,,,
CWSDFS20141206A2,CW,12/6/2014,2014,6,12,232.6,1396,35822-46-9,DF,1234678-HpCDD,32.3,0.323,0.323,104,0,Co-location,,,,,,
CWSDFS20141206A2,CW,12/6/2014,2014,6,12,232.6,1396,39001-02-0,DF,OCDF,17.9,0.0179,0.0179,104,0,Co-location,,,,,,
CWSDFS20141206A2,CW,12/6/2014,2014,6,12,232.6,1396,3268-87-9,DF,OCDD,164,0.164,0.164,104,0,Co-location,,,,,,
CWSDFS20141206A2,CW,12/6/2014,2014,6,12,232.6,1396,DIOXIN,DF,DIOXIN,7.6,0.023,0.0234,105,0,Co-location,,,,,,
TWSDFS20141806,TW,18/6/2014,2014,6,18,231.8,1421,51207-31-9,DF,2378-TCDF,2.4,0.24,0.24,104,1,,,,,,,
TWSDFS20141806,TW,18/6/2014,2014,6,18,231.8,1421,1746-01-6,DF,2378-TCDD,-0.5,0.25,0.25,104,1,,,,,,,
TWSDFS20141806,TW,18/6/2014,2014,6,18,231.8,1421,57117-41-6,DF,12378-PeCDF,-2.5,0.0625,0.0625,104,1,,,,,,,
TWSDFS20141806,TW,18/6/2014,2014,6,18,231.8,1421,57117-31-4,DF,23478-PeCDF,-2.5,0.625,0.625,104,1,,,,,,,
TWSDFS20141806,TW,18/6/2014,2014,6,18,231.8,1421,40321-76-4,DF,12378-PeCDD,-2.5,0.625,0.625,104,1,,,,,,,
TWSDFS20141806,TW,18/6/2014,2014,6,18,231.8,1421,70648-26-9,DF,123478-HxCDF,-2.5,0.125,0.125,104,1,,,,,,,
TWSDFS20141806,TW,18/6/2014,2014,6,18,231.8,1421,57117-44-9,DF,123678-HxCDF,-2.5,0.125,0.125,104,1,,,,,,,
TWSDFS20141806,TW,18/6/2014,2014,6,18,231.8,1421,60851-34-5,DF,234678-HxCDF,-2.5,0.125,0.125,104,1,,,,,,,
TWSDFS20141806,TW,18/6/2014,2014,6,18,231.8,1421,72918-21-9,DF,123789-HxCDF,-2.5,0.125,0.125,104,1,,,,,,,
TWSDFS20141806,TW,18/6/2014,2014,6,18,231.8,1421,39227-28-6,DF,123478-HxCDD,-2.5,0.125,0.125,104,1,,,,,,,
TWSDFS20141806,TW,18/6/2014,2014,6,18,231.8,1421,57653-85-7,DF,123678-HxCDD,-2.5,0.125,0.125,104,1,,,,,,,
TWSDFS20141806,TW,18/6/2014,2014,6,18,231.8,1421,19408-74-3,DF,123789-HxCDD,-2.5,0.125,0.125,104,1,,,,,,,
TWSDFS20141806,TW,18/6/2014,2014,6,18,231.8,1421,67562-39-4,DF,1234678-HpCDF,-2.5,0.0125,0.0125,104,1,,,,,,,
TWSDFS20141806,TW,18/6/2014,2014,6,18,231.8,1421,55673-89-7,DF,1234789-HpCDF,-2.5,0.0125,0.0125,104,1,,,,,,,
TWSDFS20141806,TW,18/6/2014,2014,6,18,231.8,1421,35822-46-9,DF,1234678-HpCDD,9.4,0.094,0.094,104,1,,,,,,,
TWSDFS20141806,TW,18/6/2014,2014,6,18,231.8,1421,39001-02-0,DF,OCDF,-5,0.0025,0.0025,104,1,,,,,,,
TWSDFS20141806,TW,18/6/2014,2014,6,18,231.8,1421,3268-87-9,DF,OCDD,40.7,0.0407,0.0407,104,1,,,,,,,
TWSDFS20141806,TW,18/6/2014,2014,6,18,231.8,1421,DIOXIN,DF,DIOXIN,2.8,0.009,0.0085,105,1,,,,,,,
CWSDFS20142407,CW,24/7/2014,2014,7,24,230.6,1411,51207-31-9,DF,2378-TCDF,4.1,0.41,0.41,104,1,,,,,,,
CWSDFS20142407,CW,24/7/2014,2014,7,24,230.6,1411,1746-01-6,DF,2378-TCDD,-0.5,0.25,0.25,104,1,,,,,,,
CWSDFS20142407,CW,24/7/2014,2014,7,24,230.6,1411,57117-41-6,DF,12378-PeCDF,-2.5,0.0625,0.0625,104,1,,,,,,,
CWSDFS20142407,CW,24/7/2014,2014,7,24,230.6,1411,57117-31-4,DF,23478-PeCDF,-2.5,0.625,0.625,104,1,,,,,,,
CWSDFS20142407,CW,24/7/2014,2014,7,24,230.6,1411,40321-76-4,DF,12378-PeCDD,-2.5,0.625,0.625,104,1,,,,,,,
CWSDFS20142407,CW,24/7/2014,2014,7,24,230.6,1411,70648-26-9,DF,123478-HxCDF,-2.5,0.125,0.125,104,1,,,,,,,
CWSDFS20142407,CW,24/7/2014,2014,7,24,230.6,1411,57117-44-9,DF,123678-HxCDF,-2.5,0.125,0.125,104,1,,,,,,,
CWSDFS20142407,CW,24/7/2014,2014,7,24,230.6,1411,60851-34-5,DF,234678-HxCDF,-2.5,0.125,0.125,104,1,,,,,,,
CWSDFS20142407,CW,24/7/2014,2014,7,24,230.6,1411,72918-21-9,DF,123789-HxCDF,-2.5,0.125,0.125,104,1,,,,,,,
CWSDFS20142407,CW,24/7/2014,2014,7,24,230.6,1411,39227-28-6,DF,123478-HxCDD,-2.5,0.125,0.125,104,1,,,,,,,
CWSDFS20142407,CW,24/7/2014,2014,7,24,230.6,1411,57653-85-7,DF,123678-HxCDD,-2.5,0.125,0.125,104,1,,,,,,,
CWSDFS20142407,CW,24/7/2014,2014,7,24,230.6,1411,19408-74-3,DF,123789-HxCDD,-2.5,0.125,0.125,104,1,,,,,,,
CWSDFS20142407,CW,24/7/2014,2014,7,24,230.6,1411,67562-39-4,DF,1234678-HpCDF,5.5,0.055,0.055,104,1,,,,,,,
CWSDFS20142407,CW,24/7/2014,2014,7,24,230.6,1411,55673-89-7,DF,1234789-HpCDF,-2.5,0.0125,0.0125,104,1,,,,,,,
CWSDFS20142407,CW,24/7/2014,2014,7,24,230.6,1411,35822-46-9,DF,1234678-HpCDD,30.3,0.303,0.303,104,1,,,,,,,
CWSDFS20142407,CW,24/7/2014,2014,7,24,230.6,1411,39001-02-0,DF,OCDF,-5,0.0025,0.0025,104,1,,,,,,,
CWSDFS20142407,CW,24/7/2014,2014,7,24,230.6,1411,3268-87-9,DF,OCDD,191,0.191,0.191,104,1,,,,,,,
CWSDFS20142407,CW,24/7/2014,2014,7,24,230.6,1411,DIOXIN,DF,DIOXIN,3.4,0.01,0.0104,105,1,,,,,,,
TWSDFS20140607A1,TW,6/7/2014,2014,7,6,229.7,1421,51207-31-9,DF,2378-TCDF,3.3,0.33,0.33,104,1,,,,,,,
TWSDFS20140607A1,TW,6/7/2014,2014,7,6,229.7,1421,1746-01-6,DF,2378-TCDD,-0.5,0.25,0.25,104,1,,,,,,,
TWSDFS20140607A1,TW,6/7/2014,2014,7,6,229.7,1421,57117-41-6,DF,12378-PeCDF,-2.5,0.0625,0.0625,104,1,,,,,,,
TWSDFS20140607A1,TW,6/7/2014,2014,7,6,229.7,1421,57117-31-4,DF,23478-PeCDF,-2.5,0.625,0.625,104,1,,,,,,,
TWSDFS20140607A1,TW,6/7/2014,2014,7,6,229.7,1421,40321-76-4,DF,12378-PeCDD,-2.5,0.625,0.625,104,1,,,,,,,
TWSDFS20140607A1,TW,6/7/2014,2014,7,6,229.7,1421,70648-26-9,DF,123478-HxCDF,-2.5,0.125,0.125,104,1,,,,,,,
TWSDFS20140607A1,TW,6/7/2014,2014,7,6,229.7,1421,57117-44-9,DF,123678-HxCDF,-2.5,0.125,0.125,104,1,,,,,,,
TWSDFS20140607A1,TW,6/7/2014,2014,7,6,229.7,1421,60851-34-5,DF,234678-HxCDF,-2.5,0.125,0.125,104,1,,,,,,,
TWSDFS20140607A1,TW,6/7/2014,2014,7,6,229.7,1421,72918-21-9,DF,123789-HxCDF,-2.5,0.125,0.125,104,1,,,,,,,
TWSDFS20140607A1,TW,6/7/2014,2014,7,6,229.7,1421,39227-28-6,DF,123478-HxCDD,-2.5,0.125,0.125,104,1,,,,,,,
TWSDFS20140607A1,TW,6/7/2014,2014,7,6,229.7,1421,57653-85-7,DF,123678-HxCDD,-2.5,0.125,0.125,104,1,,,,,,,
TWSDFS20140607A1,TW,6/7/2014,2014,7,6,229.7,1421,19408-74-3,DF,123789-HxCDD,-2.5,0.125,0.125,104,1,,,,,,,
TWSDFS20140607A1,TW,6/7/2014,2014,7,6,229.7,1421,67562-39-4,DF,1234678-HpCDF,5.2,0.052,0.052,104,1,,,,,,,
TWSDFS20140607A1,TW,6/7/2014,2014,7,6,229.7,1421,55673-89-7,DF,1234789-HpCDF,-2.5,0.0125,0.0125,104,1,,,,,,,
TWSDFS20140607A1,TW,6/7/2014,2014,7,6,229.7,1421,35822-46-9,DF,1234678-HpCDD,8.4,0.084,0.084,104,1,,,,,,,
TWSDFS20140607A1,TW,6/7/2014,2014,7,6,229.7,1421,39001-02-0,DF,OCDF,-5,0.0025,0.0025,104,1,,,,,,,
TWSDFS20140607A1,TW,6/7/2014,2014,7,6,229.7,1421,3268-87-9,DF,OCDD,31.8,0.0318,0.0318,104,1,,,,,,,
TWSDFS20140607A1,TW,6/7/2014,2014,7,6,229.7,1421,DIOXIN,DF,DIOXIN,3,0.009,0.0092,105,1,,,,,,,
TWSDFS20140607A2,TW,6/7/2014,2014,7,6,229.6,1435,51207-31-9,DF,2378-TCDF,3.7,0.37,0.37,104,0,Co-location,,,,,,
TWSDFS20140607A2,TW,6/7/2014,2014,7,6,229.6,1435,1746-01-6,DF,2378-TCDD,-0.5,0.25,0.25,104,0,Co-location,,,,,,
TWSDFS20140607A2,TW,6/7/2014,2014,7,6,229.6,1435,57117-41-6,DF,12378-PeCDF,-2.5,0.0625,0.0625,104,0,Co-location,,,,,,
TWSDFS20140607A2,TW,6/7/2014,2014,7,6,229.6,1435,57117-31-4,DF,23478-PeCDF,-2.5,0.625,0.625,104,0,Co-location,,,,,,
TWSDFS20140607A2,TW,6/7/2014,2014,7,6,229.6,1435,40321-76-4,DF,12378-PeCDD,-2.5,0.625,0.625,104,0,Co-location,,,,,,
TWSDFS20140607A2,TW,6/7/2014,2014,7,6,229.6,1435,70648-26-9,DF,123478-HxCDF,-2.5,0.125,0.125,104,0,Co-location,,,,,,
TWSDFS20140607A2,TW,6/7/2014,2014,7,6,229.6,1435,57117-44-9,DF,123678-HxCDF,-2.5,0.125,0.125,104,0,Co-location,,,,,,
TWSDFS20140607A2,TW,6/7/2014,2014,7,6,229.6,1435,60851-34-5,DF,234678-HxCDF,-2.5,0.125,0.125,104,0,Co-location,,,,,,
TWSDFS20140607A2,TW,6/7/2014,2014,7,6,229.6,1435,72918-21-9,DF,123789-HxCDF,-2.5,0.125,0.125,104,0,Co-location,,,,,,
TWSDFS20140607A2,TW,6/7/2014,2014,7,6,229.6,1435,39227-28-6,DF,123478-HxCDD,-2.5,0.125,0.125,104,0,Co-location,,,,,,
TWSDFS20140607A2,TW,6/7/2014,2014,7,6,229.6,1435,57653-85-7,DF,123678-HxCDD,-2.5,0.125,0.125,104,0,Co-location,,,,,,
TWSDFS20140607A2,TW,6/7/2014,2014,7,6,229.6,1435,19408-74-3,DF,123789-HxCDD,-2.5,0.125,0.125,104,0,Co-location,,,,,,
TWSDFS20140607A2,TW,6/7/2014,2014,7,6,229.6,1435,67562-39-4,DF,1234678-HpCDF,5.6,0.056,0.056,104,0,Co-location,,,,,,
TWSDFS20140607A2,TW,6/7/2014,2014,7,6,229.6,1435,55673-89-7,DF,1234789-HpCDF,-2.5,0.0125,0.0125,104,0,Co-location,,,,,,
TWSDFS20140607A2,TW,6/7/2014,2014,7,6,229.6,1435,35822-46-9,DF,1234678-HpCDD,9.8,0.098,0.098,104,0,Co-location,,,,,,
TWSDFS20140607A2,TW,6/7/2014,2014,7,6,229.6,1435,39001-02-0,DF,OCDF,-5,0.0025,0.0025,104,0,Co-location,,,,,,
TWSDFS20140607A2,TW,6/7/2014,2014,7,6,229.6,1435,3268-87-9,DF,OCDD,38.6,0.0386,0.0386,104,0,Co-location,,,,,,
TWSDFS20140607A2,TW,6/7/2014,2014,7,6,229.6,1435,DIOXIN,DF,DIOXIN,3,0.009,0.0091,105,0,Co-location,,,,,,
CWSDFS20140508,CW,5/8/2014,2014,8,5,230.6,1441,51207-31-9,DF,2378-TCDF,5.2,0.52,0.52,104,1,,,,,,,
CWSDFS20140508,CW,5/8/2014,2014,8,5,230.6,1441,1746-01-6,DF,2378-TCDD,-0.5,0.25,0.25,104,1,,,,,,,
CWSDFS20140508,CW,5/8/2014,2014,8,5,230.6,1441,57117-41-6,DF,12378-PeCDF,-2.5,0.0625,0.0625,104,1,,,,,,,
CWSDFS20140508,CW,5/8/2014,2014,8,5,230.6,1441,57117-31-4,DF,23478-PeCDF,-2.5,0.625,0.625,104,1,,,,,,,
CWSDFS20140508,CW,5/8/2014,2014,8,5,230.6,1441,40321-76-4,DF,12378-PeCDD,-2.5,0.625,0.625,104,1,,,,,,,
CWSDFS20140508,CW,5/8/2014,2014,8,5,230.6,1441,70648-26-9,DF,123478-HxCDF,2.7,0.27,0.27,104,1,,,,,,,
CWSDFS20140508,CW,5/8/2014,2014,8,5,230.6,1441,57117-44-9,DF,123678-HxCDF,2.7,0.27,0.27,104,1,,,,,,,
CWSDFS20140508,CW,5/8/2014,2014,8,5,230.6,1441,60851-34-5,DF,234678-HxCDF,-2.5,0.125,0.125,104,1,,,,,,,
CWSDFS20140508,CW,5/8/2014,2014,8,5,230.6,1441,72918-21-9,DF,123789-HxCDF,-2.5,0.125,0.125,104,1,,,,,,,
CWSDFS20140508,CW,5/8/2014,2014,8,5,230.6,1441,39227-28-6,DF,123478-HxCDD,-2.5,0.125,0.125,104,1,,,,,,,
CWSDFS20140508,CW,5/8/2014,2014,8,5,230.6,1441,57653-85-7,DF,123678-HxCDD,-2.5,0.125,0.125,104,1,,,,,,,
CWSDFS20140508,CW,5/8/2014,2014,8,5,230.6,1441,19408-74-3,DF,123789-HxCDD,-2.5,0.125,0.125,104,1,,,,,,,
CWSDFS20140508,CW,5/8/2014,2014,8,5,230.6,1441,67562-39-4,DF,1234678-HpCDF,9.9,0.099,0.099,104,1,,,,,,,
CWSDFS20140508,CW,5/8/2014,2014,8,5,230.6,1441,55673-89-7,DF,1234789-HpCDF,-2.5,0.0125,0.0125,104,1,,,,,,,
CWSDFS20140508,CW,5/8/2014,2014,8,5,230.6,1441,35822-46-9,DF,1234678-HpCDD,22.9,0.229,0.229,104,1,,,,,,,
CWSDFS20140508,CW,5/8/2014,2014,8,5,230.6,1441,39001-02-0,DF,OCDF,6.3,0.0063,0.0063,104,1,,,,,,,
CWSDFS20140508,CW,5/8/2014,2014,8,5,230.6,1441,3268-87-9,DF,OCDD,99.2,0.0992,0.0992,104,1,,,,,,,
CWSDFS20140508,CW,5/8/2014,2014,8,5,230.6,1441,DIOXIN,DF,DIOXIN,3.7,0.011,0.0111,105,1,,,,,,,
TWSDFS20141708,TW,17/8/2014,2014,8,17,229.7,1413,51207-31-9,DF,2378-TCDF,4.1,0.41,0.41,104,1,,,,,,,
TWSDFS20141708,TW,17/8/2014,2014,8,17,229.7,1413,1746-01-6,DF,2378-TCDD,-0.5,0.25,0.25,104,1,,,,,,,
TWSDFS20141708,TW,17/8/2014,2014,8,17,229.7,1413,57117-41-6,DF,12378-PeCDF,-2.5,0.0625,0.0625,104,1,,,,,,,
TWSDFS20141708,TW,17/8/2014,2014,8,17,229.7,1413,57117-31-4,DF,23478-PeCDF,-2.5,0.625,0.625,104,1,,,,,,,
TWSDFS20141708,TW,17/8/2014,2014,8,17,229.7,1413,40321-76-4,DF,12378-PeCDD,-2.5,0.625,0.625,104,1,,,,,,,
TWSDFS20141708,TW,17/8/2014,2014,8,17,229.7,1413,70648-26-9,DF,123478-HxCDF,-2.5,0.125,0.125,104,1,,,,,,,
TWSDFS20141708,TW,17/8/2014,2014,8,17,229.7,1413,57117-44-9,DF,123678-HxCDF,-2.5,0.125,0.125,104,1,,,,,,,
TWSDFS20141708,TW,17/8/2014,2014,8,17,229.7,1413,60851-34-5,DF,234678-HxCDF,-2.5,0.125,0.125,104,1,,,,,,,
TWSDFS20141708,TW,17/8/2014,2014,8,17,229.7,1413,72918-21-9,DF,123789-HxCDF,-2.5,0.125,0.125,104,1,,,,,,,
TWSDFS20141708,TW,17/8/2014,2014,8,17,229.7,1413,39227-28-6,DF,123478-HxCDD,-2.5,0.125,0.125,104,1,,,,,,,
TWSDFS20141708,TW,17/8/2014,2014,8,17,229.7,1413,57653-85-7,DF,123678-HxCDD,-2.5,0.125,0.125,104,1,,,,,,,
TWSDFS20141708,TW,17/8/2014,2014,8,17,229.7,1413,19408-74-3,DF,123789-HxCDD,-2.5,0.125,0.125,104,1,,,,,,,
TWSDFS20141708,TW,17/8/2014,2014,8,17,229.7,1413,67562-39-4,DF,1234678-HpCDF,-2.5,0.0125,0.0125,104,1,,,,,,,
TWSDFS20141708,TW,17/8/2014,2014,8,17,229.7,1413,55673-89-7,DF,1234789-HpCDF,-2.5,0.0125,0.0125,104,1,,,,,,,
TWSDFS20141708,TW,17/8/2014,2014,8,17,229.7,1413,35822-46-9,DF,1234678-HpCDD,9.2,0.092,0.092,104,1,,,,,,,
TWSDFS20141708,TW,17/8/2014,2014,8,17,229.7,1413,39001-02-0,DF,OCDF,-5,0.0025,0.0025,104,1,,,,,,,
TWSDFS20141708,TW,17/8/2014,2014,8,17,229.7,1413,3268-87-9,DF,OCDD,41.6,0.0416,0.0416,104,1,,,,,,,
TWSDFS20141708,TW,17/8/2014,2014,8,17,229.7,1413,DIOXIN,DF,DIOXIN,3,0.009,0.0092,105,1,,,,,,,
CWSDFS20141609A1,CW,16/9/2014,2014,9,16,230.4,1427,51207-31-9,DF,2378-TCDF,2.7,0.27,0.27,104,1,,,,,,,
CWSDFS20141609A1,CW,16/9/2014,2014,9,16,230.4,1427,1746-01-6,DF,2378-TCDD,-0.5,0.25,0.25,104,1,,,,,,,
CWSDFS20141609A1,CW,16/9/2014,2014,9,16,230.4,1427,57117-41-6,DF,12378-PeCDF,-2.5,0.0625,0.0625,104,1,,,,,,,
CWSDFS20141609A1,CW,16/9/2014,2014,9,16,230.4,1427,57117-31-4,DF,23478-PeCDF,-2.5,0.625,0.625,104,1,,,,,,,
CWSDFS20141609A1,CW,16/9/2014,2014,9,16,230.4,1427,40321-76-4,DF,12378-PeCDD,-2.5,0.625,0.625,104,1,,,,,,,
CWSDFS20141609A1,CW,16/9/2014,2014,9,16,230.4,1427,70648-26-9,DF,123478-HxCDF,-2.5,0.125,0.125,104,1,,,,,,,
CWSDFS20141609A1,CW,16/9/2014,2014,9,16,230.4,1427,57117-44-9,DF,123678-HxCDF,-2.5,0.125,0.125,104,1,,,,,,,
CWSDFS20141609A1,CW,16/9/2014,2014,9,16,230.4,1427,60851-34-5,DF,234678-HxCDF,-2.5,0.125,0.125,104,1,,,,,,,
CWSDFS20141609A1,CW,16/9/2014,2014,9,16,230.4,1427,72918-21-9,DF,123789-HxCDF,-2.5,0.125,0.125,104,1,,,,,,,
CWSDFS20141609A1,CW,16/9/2014,2014,9,16,230.4,1427,39227-28-6,DF,123478-HxCDD,-2.5,0.125,0.125,104,1,,,,,,,
CWSDFS20141609A1,CW,16/9/2014,2014,9,16,230.4,1427,57653-85-7,DF,123678-HxCDD,-2.5,0.125,0.125,104,1,,,,,,,
CWSDFS20141609A1,CW,16/9/2014,2014,9,16,230.4,1427,19408-74-3,DF,123789-HxCDD,-2.5,0.125,0.125,104,1,,,,,,,
CWSDFS20141609A1,CW,16/9/2014,2014,9,16,230.4,1427,67562-39-4,DF,1234678-HpCDF,3,0.03,0.03,104,1,,,,,,,
CWSDFS20141609A1,CW,16/9/2014,2014,9,16,230.4,1427,55673-89-7,DF,1234789-HpCDF,-2.5,0.0125,0.0125,104,1,,,,,,,
CWSDFS20141609A1,CW,16/9/2014,2014,9,16,230.4,1427,35822-46-9,DF,1234678-HpCDD,28.7,0.287,0.287,104,1,,,,,,,
CWSDFS20141609A1,CW,16/9/2014,2014,9,16,230.4,1427,39001-02-0,DF,OCDF,-5,0.0025,0.0025,104,1,,,,,,,
CWSDFS20141609A1,CW,16/9/2014,2014,9,16,230.4,1427,3268-87-9,DF,OCDD,105,0.105,0.105,104,1,,,,,,,
CWSDFS20141609A1,CW,16/9/2014,2014,9,16,230.4,1427,DIOXIN,DF,DIOXIN,3.1,0.01,0.0094,105,1,,,,,,,
CWSDFS20141609A2,CW,16/9/2014,2014,9,16,232.4,1406,51207-31-9,DF,2378-TCDF,2.7,0.27,0.27,104,0,Co-location,,,,,,
CWSDFS20141609A2,CW,16/9/2014,2014,9,16,232.4,1406,1746-01-6,DF,2378-TCDD,-0.5,0.25,0.25,104,0,Co-location,,,,,,
CWSDFS20141609A2,CW,16/9/2014,2014,9,16,232.4,1406,57117-41-6,DF,12378-PeCDF,-2.5,0.0625,0.0625,104,0,Co-location,,,,,,
CWSDFS20141609A2,CW,16/9/2014,2014,9,16,232.4,1406,57117-31-4,DF,23478-PeCDF,-2.5,0.625,0.625,104,0,Co-location,,,,,,
CWSDFS20141609A2,CW,16/9/2014,2014,9,16,232.4,1406,40321-76-4,DF,12378-PeCDD,-2.5,0.625,0.625,104,0,Co-location,,,,,,
CWSDFS20141609A2,CW,16/9/2014,2014,9,16,232.4,1406,70648-26-9,DF,123478-HxCDF,-2.5,0.125,0.125,104,0,Co-location,,,,,,
CWSDFS20141609A2,CW,16/9/2014,2014,9,16,232.4,1406,57117-44-9,DF,123678-HxCDF,-2.5,0.125,0.125,104,0,Co-location,,,,,,
CWSDFS20141609A2,CW,16/9/2014,2014,9,16,232.4,1406,60851-34-5,DF,234678-HxCDF,-2.5,0.125,0.125,104,0,Co-location,,,,,,
CWSDFS20141609A2,CW,16/9/2014,2014,9,16,232.4,1406,72918-21-9,DF,123789-HxCDF,-2.5,0.125,0.125,104,0,Co-location,,,,,,
CWSDFS20141609A2,CW,16/9/2014,2014,9,16,232.4,1406,39227-28-6,DF,123478-HxCDD,-2.5,0.125,0.125,104,0,Co-location,,,,,,
CWSDFS20141609A2,CW,16/9/2014,2014,9,16,232.4,1406,57653-85-7,DF,123678-HxCDD,-2.5,0.125,0.125,104,0,Co-location,,,,,,
CWSDFS20141609A2,CW,16/9/2014,2014,9,16,232.4,1406,19408-74-3,DF,123789-HxCDD,-2.5,0.125,0.125,104,0,Co-location,,,,,,
CWSDFS20141609A2,CW,16/9/2014,2014,9,16,232.4,1406,67562-39-4,DF,1234678-HpCDF,2.7,0.027,0.027,104,0,Co-location,,,,,,
CWSDFS20141609A2,CW,16/9/2014,2014,9,16,232.4,1406,55673-89-7,DF,1234789-HpCDF,-2.5,0.0125,0.0125,104,0,Co-location,,,,,,
CWSDFS20141609A2,CW,16/9/2014,2014,9,16,232.4,1406,35822-46-9,DF,1234678-HpCDD,26.2,0.262,0.262,104,0,Co-location,,,,,,
CWSDFS20141609A2,CW,16/9/2014,2014,9,16,232.4,1406,39001-02-0,DF,OCDF,-5,0.0025,0.0025,104,0,Co-location,,,,,,
CWSDFS20141609A2,CW,16/9/2014,2014,9,16,232.4,1406,3268-87-9,DF,OCDD,101,0.101,0.101,104,0,Co-location,,,,,,
CWSDFS20141609A2,CW,16/9/2014,2014,9,16,232.4,1406,DIOXIN,DF,DIOXIN,3.1,0.01,0.0095,105,0,Co-location,,,,,,
TWSDFS20142209,TW,22/9/2014,2014,9,22,231,1400,51207-31-9,DF,2378-TCDF,11.1,1.11,1.11,104,1,,,,,,,
TWSDFS20142209,TW,22/9/2014,2014,9,22,231,1400,1746-01-6,DF,2378-TCDD,-0.5,0.25,0.25,104,1,,,,,,,
TWSDFS20142209,TW,22/9/2014,2014,9,22,231,1400,57117-41-6,DF,12378-PeCDF,14.8,0.74,0.74,104,1,,,,,,,
TWSDFS20142209,TW,22/9/2014,2014,9,22,231,1400,57117-31-4,DF,23478-PeCDF,17.5,8.75,8.75,104,1,,,,,,,
TWSDFS20142209,TW,22/9/2014,2014,9,22,231,1400,40321-76-4,DF,12378-PeCDD,-2.5,0.625,0.625,104,1,,,,,,,
TWSDFS20142209,TW,22/9/2014,2014,9,22,231,1400,70648-26-9,DF,123478-HxCDF,26.1,2.61,2.61,104,1,,,,,,,
TWSDFS20142209,TW,22/9/2014,2014,9,22,231,1400,57117-44-9,DF,123678-HxCDF,24.2,2.42,2.42,104,1,,,,,,,
TWSDFS20142209,TW,22/9/2014,2014,9,22,231,1400,60851-34-5,DF,234678-HxCDF,24.2,2.42,2.42,104,1,,,,,,,
TWSDFS20142209,TW,22/9/2014,2014,9,22,231,1400,72918-21-9,DF,123789-HxCDF,-2.5,0.125,0.125,104,1,,,,,,,
TWSDFS20142209,TW,22/9/2014,2014,9,22,231,1400,39227-28-6,DF,123478-HxCDD,-2.5,0.125,0.125,104,1,,,,,,,
TWSDFS20142209,TW,22/9/2014,2014,9,22,231,1400,57653-85-7,DF,123678-HxCDD,-2.5,0.125,0.125,104,1,,,,,,,
TWSDFS20142209,TW,22/9/2014,2014,9,22,231,1400,19408-74-3,DF,123789-HxCDD,4.4,0.44,0.44,104,1,,,,,,,
TWSDFS20142209,TW,22/9/2014,2014,9,22,231,1400,67562-39-4,DF,1234678-HpCDF,157,1.57,1.57,104,1,,,,,,,
TWSDFS20142209,TW,22/9/2014,2014,9,22,231,1400,55673-89-7,DF,1234789-HpCDF,23.2,0.232,0.232,104,1,,,,,,,
TWSDFS20142209,TW,22/9/2014,2014,9,22,231,1400,35822-46-9,DF,1234678-HpCDD,59.6,0.596,0.596,104,1,,,,,,,
TWSDFS20142209,TW,22/9/2014,2014,9,22,231,1400,39001-02-0,DF,OCDF,157,0.157,0.157,104,1,,,,,,,
TWSDFS20142209,TW,22/9/2014,2014,9,22,231,1400,3268-87-9,DF,OCDD,261,0.261,0.261,104,1,,,,,,,
TWSDFS20142209,TW,22/9/2014,2014,9,22,231,1400,DIOXIN,DF,DIOXIN,22.6,0.07,0.0699,105,1,,,,,,,
CWSDFS20142501,CW,25/1/2014,2014,1,25,232,1459,70362-50-4,Dl-PB,PCB 81,-10,0.0015,0.0015,110,1,,,,,,,
CWSDFS20142501,CW,25/1/2014,2014,1,25,232,1459,32598-13-3,Dl-PB,PCB 77,66.8,0.00668,0.00668,110,1,,,,,,,
CWSDFS20142501,CW,25/1/2014,2014,1,25,232,1459,65510-44-3,Dl-PB,PCB 123,-100,0.0015,0.0015,110,1,,,,,,,
CWSDFS20142501,CW,25/1/2014,2014,1,25,232,1459,31508-00-6,Dl-PB,PCB 118,213,0.00639,0.00639,110,1,,,,,,,
CWSDFS20142501,CW,25/1/2014,2014,1,25,232,1459,74472-37-0,Dl-PB,PCB 114,-20,0.0003,0.0003,110,1,,,,,,,
CWSDFS20142501,CW,25/1/2014,2014,1,25,232,1459,32598-14-4,Dl-PB,PCB 105,-100,0.0015,0.0015,110,1,,,,,,,
CWSDFS20142501,CW,25/1/2014,2014,1,25,232,1459,57465-28-8,Dl-PB,PCB 126,11.8,1.18,1.18,110,1,,,,,,,
CWSDFS20142501,CW,25/1/2014,2014,1,25,232,1459,52663-72-6,Dl-PB,PCB 167,-20,0.0003,0.0003,110,1,,,,,,,
CWSDFS20142501,CW,25/1/2014,2014,1,25,232,1459,38380-08-4,Dl-PB,PCB 156,28.5,0.000855,0.000855,110,1,,,,,,,
CWSDFS20142501,CW,25/1/2014,2014,1,25,232,1459,69782-90-7,Dl-PB,PCB 157,-20,0.0003,0.0003,110,1,,,,,,,
CWSDFS20142501,CW,25/1/2014,2014,1,25,232,1459,32774-16-6,Dl-PB,PCB 169,-10,0.15,0.15,110,1,,,,,,,
CWSDFS20142501,CW,25/1/2014,2014,1,25,232,1459,39635-31-9,Dl-PB,PCB 189,-20,0.0003,0.0003,110,1,,,,,,,
CWSDFS20142501,CW,25/1/2014,2014,1,25,232,1459,Dioxin-like PCB,Dl-PB,Dioxin-like PCB,1.35,0.004,0.004,111,1,,,,,,,
TWSDFS20140701A1,TW,7/1/2014,2014,1,7,232.5,1420,70362-50-4,Dl-PB,PCB 81,10.6,0.00318,0.00318,110,1,,,,,,,
TWSDFS20140701A1,TW,7/1/2014,2014,1,7,232.5,1420,32598-13-3,Dl-PB,PCB 77,55.8,0.00558,0.00558,110,1,,,,,,,
TWSDFS20140701A1,TW,7/1/2014,2014,1,7,232.5,1420,65510-44-3,Dl-PB,PCB 123,-100,0.0015,0.0015,110,1,,,,,,,
TWSDFS20140701A1,TW,7/1/2014,2014,1,7,232.5,1420,31508-00-6,Dl-PB,PCB 118,197,0.00591,0.00591,110,1,,,,,,,
TWSDFS20140701A1,TW,7/1/2014,2014,1,7,232.5,1420,74472-37-0,Dl-PB,PCB 114,-20,0.0003,0.0003,110,1,,,,,,,
TWSDFS20140701A1,TW,7/1/2014,2014,1,7,232.5,1420,32598-14-4,Dl-PB,PCB 105,-100,0.0015,0.0015,110,1,,,,,,,
TWSDFS20140701A1,TW,7/1/2014,2014,1,7,232.5,1420,57465-28-8,Dl-PB,PCB 126,12.9,1.29,1.29,110,1,,,,,,,
TWSDFS20140701A1,TW,7/1/2014,2014,1,7,232.5,1420,52663-72-6,Dl-PB,PCB 167,-20,0.0003,0.0003,110,1,,,,,,,
TWSDFS20140701A1,TW,7/1/2014,2014,1,7,232.5,1420,38380-08-4,Dl-PB,PCB 156,25,0.00075,0.00075,110,1,,,,,,,
TWSDFS20140701A1,TW,7/1/2014,2014,1,7,232.5,1420,69782-90-7,Dl-PB,PCB 157,-20,0.0003,0.0003,110,1,,,,,,,
TWSDFS20140701A1,TW,7/1/2014,2014,1,7,232.5,1420,32774-16-6,Dl-PB,PCB 169,-10,0.15,0.15,110,1,,,,,,,
TWSDFS20140701A1,TW,7/1/2014,2014,1,7,232.5,1420,39635-31-9,Dl-PB,PCB 189,-20,0.0003,0.0003,110,1,,,,,,,
TWSDFS20140701A1,TW,7/1/2014,2014,1,7,232.5,1420,Dioxin-like PCB,Dl-PB,Dioxin-like PCB,1.46,0.0044,0.0044,111,1,,,,,,,
TWSDFS20140701A2,TW,7/1/2014,2014,1,7,231.7,1453,70362-50-4,Dl-PB,PCB 81,10.3,0.00309,0.00309,110,0,Co-location,,,,,,
TWSDFS20140701A2,TW,7/1/2014,2014,1,7,231.7,1453,32598-13-3,Dl-PB,PCB 77,48.2,0.00482,0.00482,110,0,Co-location,,,,,,
TWSDFS20140701A2,TW,7/1/2014,2014,1,7,231.7,1453,65510-44-3,Dl-PB,PCB 123,-100,0.0015,0.0015,110,0,Co-location,,,,,,
TWSDFS20140701A2,TW,7/1/2014,2014,1,7,231.7,1453,31508-00-6,Dl-PB,PCB 118,198,0.00594,0.00594,110,0,Co-location,,,,,,
TWSDFS20140701A2,TW,7/1/2014,2014,1,7,231.7,1453,74472-37-0,Dl-PB,PCB 114,-20,0.0003,0.0003,110,0,Co-location,,,,,,
TWSDFS20140701A2,TW,7/1/2014,2014,1,7,231.7,1453,32598-14-4,Dl-PB,PCB 105,-100,0.0015,0.0015,110,0,Co-location,,,,,,
TWSDFS20140701A2,TW,7/1/2014,2014,1,7,231.7,1453,57465-28-8,Dl-PB,PCB 126,12.2,1.22,1.22,110,0,Co-location,,,,,,
TWSDFS20140701A2,TW,7/1/2014,2014,1,7,231.7,1453,52663-72-6,Dl-PB,PCB 167,-20,0.0003,0.0003,110,0,Co-location,,,,,,
TWSDFS20140701A2,TW,7/1/2014,2014,1,7,231.7,1453,38380-08-4,Dl-PB,PCB 156,26.2,0.000786,0.000786,110,0,Co-location,,,,,,
TWSDFS20140701A2,TW,7/1/2014,2014,1,7,231.7,1453,69782-90-7,Dl-PB,PCB 157,-20,0.0003,0.0003,110,0,Co-location,,,,,,
TWSDFS20140701A2,TW,7/1/2014,2014,1,7,231.7,1453,32774-16-6,Dl-PB,PCB 169,-10,0.15,0.15,110,0,Co-location,,,,,,
TWSDFS20140701A2,TW,7/1/2014,2014,1,7,231.7,1453,39635-31-9,Dl-PB,PCB 189,-20,0.0003,0.0003,110,0,Co-location,,,,,,
TWSDFS20140701A2,TW,7/1/2014,2014,1,7,231.7,1453,Dioxin-like PCB,Dl-PB,Dioxin-like PCB,1.39,0.0041,0.0041,111,0,Co-location,,,,,,
CWSDFS20141202,CW,12/2/2014,2014,2,12,230.7,1433,70362-50-4,Dl-PB,PCB 81,-10,0.0015,0.0015,110,1,,,,,,,
CWSDFS20141202,CW,12/2/2014,2014,2,12,230.7,1433,32598-13-3,Dl-PB,PCB 77,32.9,0.00329,0.00329,110,1,,,,,,,
CWSDFS20141202,CW,12/2/2014,2014,2,12,230.7,1433,65510-44-3,Dl-PB,PCB 123,-100,0.0015,0.0015,110,1,,,,,,,
CWSDFS20141202,CW,12/2/2014,2014,2,12,230.7,1433,31508-00-6,Dl-PB,PCB 118,127,0.00381,0.00381,110,1,,,,,,,
CWSDFS20141202,CW,12/2/2014,2014,2,12,230.7,1433,74472-37-0,Dl-PB,PCB 114,-20,0.0003,0.0003,110,1,,,,,,,
CWSDFS20141202,CW,12/2/2014,2014,2,12,230.7,1433,32598-14-4,Dl-PB,PCB 105,-100,0.0015,0.0015,110,1,,,,,,,
CWSDFS20141202,CW,12/2/2014,2014,2,12,230.7,1433,57465-28-8,Dl-PB,PCB 126,-10,0.5,0.5,110,1,,,,,,,
CWSDFS20141202,CW,12/2/2014,2014,2,12,230.7,1433,52663-72-6,Dl-PB,PCB 167,-20,0.0003,0.0003,110,1,,,,,,,
CWSDFS20141202,CW,12/2/2014,2014,2,12,230.7,1433,38380-08-4,Dl-PB,PCB 156,20.2,0.000606,0.000606,110,1,,,,,,,
CWSDFS20141202,CW,12/2/2014,2014,2,12,230.7,1433,69782-90-7,Dl-PB,PCB 157,-20,0.0003,0.0003,110,1,,,,,,,
CWSDFS20141202,CW,12/2/2014,2014,2,12,230.7,1433,32774-16-6,Dl-PB,PCB 169,-10,0.15,0.15,110,1,,,,,,,
CWSDFS20141202,CW,12/2/2014,2014,2,12,230.7,1433,39635-31-9,Dl-PB,PCB 189,-20,0.0003,0.0003,110,1,,,,,,,
CWSDFS20141202,CW,12/2/2014,2014,2,12,230.7,1433,Dioxin-like PCB,Dl-PB,Dioxin-like PCB,0.66,0.002,0.002,111,1,,,,,,,
TWSDFS20141802,TW,18/2/2014,2014,2,18,232.5,1437,70362-50-4,Dl-PB,PCB 81,32.5,0.00975,0.00975,110,1,,,,,,,
TWSDFS20141802,TW,18/2/2014,2014,2,18,232.5,1437,32598-13-3,Dl-PB,PCB 77,151,0.0151,0.0151,110,1,,,,,,,
TWSDFS20141802,TW,18/2/2014,2014,2,18,232.5,1437,65510-44-3,Dl-PB,PCB 123,-100,0.0015,0.0015,110,1,,,,,,,
TWSDFS20141802,TW,18/2/2014,2014,2,18,232.5,1437,31508-00-6,Dl-PB,PCB 118,408,0.01224,0.01224,110,1,,,,,,,
TWSDFS20141802,TW,18/2/2014,2014,2,18,232.5,1437,74472-37-0,Dl-PB,PCB 114,34.3,0.001029,0.001029,110,1,,,,,,,
TWSDFS20141802,TW,18/2/2014,2014,2,18,232.5,1437,32598-14-4,Dl-PB,PCB 105,174,0.00522,0.00522,110,1,,,,,,,
TWSDFS20141802,TW,18/2/2014,2014,2,18,232.5,1437,57465-28-8,Dl-PB,PCB 126,44.5,4.45,4.45,110,1,,,,,,,
TWSDFS20141802,TW,18/2/2014,2014,2,18,232.5,1437,52663-72-6,Dl-PB,PCB 167,25.7,0.000771,0.000771,110,1,,,,,,,
TWSDFS20141802,TW,18/2/2014,2014,2,18,232.5,1437,38380-08-4,Dl-PB,PCB 156,59.4,0.001782,0.001782,110,1,,,,,,,
TWSDFS20141802,TW,18/2/2014,2014,2,18,232.5,1437,69782-90-7,Dl-PB,PCB 157,24.5,0.000735,0.000735,110,1,,,,,,,
TWSDFS20141802,TW,18/2/2014,2014,2,18,232.5,1437,32774-16-6,Dl-PB,PCB 169,16.2,0.486,0.486,110,1,,,,,,,
TWSDFS20141802,TW,18/2/2014,2014,2,18,232.5,1437,39635-31-9,Dl-PB,PCB 189,36.6,0.001098,0.001098,110,1,,,,,,,
TWSDFS20141802,TW,18/2/2014,2014,2,18,232.5,1437,Dioxin-like PCB,Dl-PB,Dioxin-like PCB,4.99,0.0149,0.0149,111,1,,,,,,,
CWSDFS20141203A1,CW,12/3/2014,2014,3,12,233.4,1417,70362-50-4,Dl-PB,PCB 81,10.5,0.00315,0.00315,110,1,,,,,,,
CWSDFS20141203A1,CW,12/3/2014,2014,3,12,233.4,1417,32598-13-3,Dl-PB,PCB 77,68.5,0.00685,0.00685,110,1,,,,,,,
CWSDFS20141203A1,CW,12/3/2014,2014,3,12,233.4,1417,65510-44-3,Dl-PB,PCB 123,-100,0.0015,0.0015,110,1,,,,,,,
CWSDFS20141203A1,CW,12/3/2014,2014,3,12,233.4,1417,31508-00-6,Dl-PB,PCB 118,317,0.00951,0.00951,110,1,,,,,,,
CWSDFS20141203A1,CW,12/3/2014,2014,3,12,233.4,1417,74472-37-0,Dl-PB,PCB 114,-20,0.0003,0.0003,110,1,,,,,,,
CWSDFS20141203A1,CW,12/3/2014,2014,3,12,233.4,1417,32598-14-4,Dl-PB,PCB 105,126,0.00378,0.00378,110,1,,,,,,,
CWSDFS20141203A1,CW,12/3/2014,2014,3,12,233.4,1417,57465-28-8,Dl-PB,PCB 126,10.7,1.07,1.07,110,1,,,,,,,
CWSDFS20141203A1,CW,12/3/2014,2014,3,12,233.4,1417,52663-72-6,Dl-PB,PCB 167,-20,0.0003,0.0003,110,1,,,,,,,
CWSDFS20141203A1,CW,12/3/2014,2014,3,12,233.4,1417,38380-08-4,Dl-PB,PCB 156,34.6,0.001038,0.001038,110,1,,,,,,,
CWSDFS20141203A1,CW,12/3/2014,2014,3,12,233.4,1417,69782-90-7,Dl-PB,PCB 157,-20,0.0003,0.0003,110,1,,,,,,,
CWSDFS20141203A1,CW,12/3/2014,2014,3,12,233.4,1417,32774-16-6,Dl-PB,PCB 169,-10,0.15,0.15,110,1,,,,,,,
CWSDFS20141203A1,CW,12/3/2014,2014,3,12,233.4,1417,39635-31-9,Dl-PB,PCB 189,-20,0.0003,0.0003,110,1,,,,,,,
CWSDFS20141203A1,CW,12/3/2014,2014,3,12,233.4,1417,Dioxin-like PCB,Dl-PB,Dioxin-like PCB,1.25,0.0038,0.0038,111,1,,,,,,,
CWSDFS20141203A2,CW,12/3/2014,2014,3,12,232.2,1389,70362-50-4,Dl-PB,PCB 81,-10,0.0015,0.0015,110,0,Co-location,,,,,,
CWSDFS20141203A2,CW,12/3/2014,2014,3,12,232.2,1389,32598-13-3,Dl-PB,PCB 77,66.2,0.00662,0.00662,110,0,Co-location,,,,,,
CWSDFS20141203A2,CW,12/3/2014,2014,3,12,232.2,1389,65510-44-3,Dl-PB,PCB 123,-100,0.0015,0.0015,110,0,Co-location,,,,,,
CWSDFS20141203A2,CW,12/3/2014,2014,3,12,232.2,1389,31508-00-6,Dl-PB,PCB 118,299,0.00897,0.00897,110,0,Co-location,,,,,,
CWSDFS20141203A2,CW,12/3/2014,2014,3,12,232.2,1389,74472-37-0,Dl-PB,PCB 114,-20,0.0003,0.0003,110,0,Co-location,,,,,,
CWSDFS20141203A2,CW,12/3/2014,2014,3,12,232.2,1389,32598-14-4,Dl-PB,PCB 105,121,0.00363,0.00363,110,0,Co-location,,,,,,
CWSDFS20141203A2,CW,12/3/2014,2014,3,12,232.2,1389,57465-28-8,Dl-PB,PCB 126,10.4,1.04,1.04,110,0,Co-location,,,,,,
CWSDFS20141203A2,CW,12/3/2014,2014,3,12,232.2,1389,52663-72-6,Dl-PB,PCB 167,-20,0.0003,0.0003,110,0,Co-location,,,,,,
CWSDFS20141203A2,CW,12/3/2014,2014,3,12,232.2,1389,38380-08-4,Dl-PB,PCB 156,32.9,0.000987,0.000987,110,0,Co-location,,,,,,
CWSDFS20141203A2,CW,12/3/2014,2014,3,12,232.2,1389,69782-90-7,Dl-PB,PCB 157,-20,0.0003,0.0003,110,0,Co-location,,,,,,
CWSDFS20141203A2,CW,12/3/2014,2014,3,12,232.2,1389,32774-16-6,Dl-PB,PCB 169,-10,0.15,0.15,110,0,Co-location,,,,,,
CWSDFS20141203A2,CW,12/3/2014,2014,3,12,232.2,1389,39635-31-9,Dl-PB,PCB 189,-20,0.0003,0.0003,110,0,Co-location,,,,,,
CWSDFS20141203A2,CW,12/3/2014,2014,3,12,232.2,1389,Dioxin-like PCB,Dl-PB,Dioxin-like PCB,1.21,0.0038,0.0038,111,0,Co-location,,,,,,
TWSDFS20142403,TW,24/3/2014,2014,3,24,231.1,1402,70362-50-4,Dl-PB,PCB 81,-10,0.0015,0.0015,110,1,,,,,,,
TWSDFS20142403,TW,24/3/2014,2014,3,24,231.1,1402,32598-13-3,Dl-PB,PCB 77,46,0.0046,0.0046,110,1,,,,,,,
TWSDFS20142403,TW,24/3/2014,2014,3,24,231.1,1402,65510-44-3,Dl-PB,PCB 123,-100,0.0015,0.0015,110,1,,,,,,,
TWSDFS20142403,TW,24/3/2014,2014,3,24,231.1,1402,31508-00-6,Dl-PB,PCB 118,184,0.00552,0.00552,110,1,,,,,,,
TWSDFS20142403,TW,24/3/2014,2014,3,24,231.1,1402,74472-37-0,Dl-PB,PCB 114,-20,0.0003,0.0003,110,1,,,,,,,
TWSDFS20142403,TW,24/3/2014,2014,3,24,231.1,1402,32598-14-4,Dl-PB,PCB 105,-100,0.0015,0.0015,110,1,,,,,,,
TWSDFS20142403,TW,24/3/2014,2014,3,24,231.1,1402,57465-28-8,Dl-PB,PCB 126,-10,0.5,0.5,110,1,,,,,,,
TWSDFS20142403,TW,24/3/2014,2014,3,24,231.1,1402,52663-72-6,Dl-PB,PCB 167,-20,0.0003,0.0003,110,1,,,,,,,
TWSDFS20142403,TW,24/3/2014,2014,3,24,231.1,1402,38380-08-4,Dl-PB,PCB 156,-20,0.0003,0.0003,110,1,,,,,,,
TWSDFS20142403,TW,24/3/2014,2014,3,24,231.1,1402,69782-90-7,Dl-PB,PCB 157,-20,0.0003,0.0003,110,1,,,,,,,
TWSDFS20142403,TW,24/3/2014,2014,3,24,231.1,1402,32774-16-6,Dl-PB,PCB 169,-10,0.15,0.15,110,1,,,,,,,
TWSDFS20142403,TW,24/3/2014,2014,3,24,231.1,1402,39635-31-9,Dl-PB,PCB 189,-20,0.0003,0.0003,110,1,,,,,,,
TWSDFS20142403,TW,24/3/2014,2014,3,24,231.1,1402,Dioxin-like PCB,Dl-PB,Dioxin-like PCB,0.67,0.0021,0.0021,111,1,,,,,,,
CWSDFS20142504,CW,25/4/2014,2014,4,25,231.3,1445,70362-50-4,Dl-PB,PCB 81,10.8,0.00324,0.00324,110,1,,,,,,,
CWSDFS20142504,CW,25/4/2014,2014,4,25,231.3,1445,32598-13-3,Dl-PB,PCB 77,78.4,0.00784,0.00784,110,1,,,,,,,
CWSDFS20142504,CW,25/4/2014,2014,4,25,231.3,1445,65510-44-3,Dl-PB,PCB 123,-100,0.0015,0.0015,110,1,,,,,,,
CWSDFS20142504,CW,25/4/2014,2014,4,25,231.3,1445,31508-00-6,Dl-PB,PCB 118,357,0.01071,0.01071,110,1,,,,,,,
CWSDFS20142504,CW,25/4/2014,2014,4,25,231.3,1445,74472-37-0,Dl-PB,PCB 114,-20,0.0003,0.0003,110,1,,,,,,,
CWSDFS20142504,CW,25/4/2014,2014,4,25,231.3,1445,32598-14-4,Dl-PB,PCB 105,147,0.00441,0.00441,110,1,,,,,,,
CWSDFS20142504,CW,25/4/2014,2014,4,25,231.3,1445,57465-28-8,Dl-PB,PCB 126,10.2,1.02,1.02,110,1,,,,,,,
CWSDFS20142504,CW,25/4/2014,2014,4,25,231.3,1445,52663-72-6,Dl-PB,PCB 167,21.9,0.000657,0.000657,110,1,,,,,,,
CWSDFS20142504,CW,25/4/2014,2014,4,25,231.3,1445,38380-08-4,Dl-PB,PCB 156,36.9,0.001107,0.001107,110,1,,,,,,,
